[
  {
    "title": "ALL INDIA MEDICOS TEST - 2024 BATCH - 2024-12-22",
    "file": "ALL_INDIA_MEDICOS_TEST_-_2024_BATCH_-_2024-12-22.json",
    "questions": 30,
    "path": "./MEDTRIX/CEREB Grand_Tests.html"
  },
  {
    "title": "Cerebel-HUM Super-30 Grand Test - 2023-09-05",
    "file": "Cerebel-HUM_Super-30_Grand_Test_-_2023-09-05.json",
    "questions": 100,
    "path": "./MEDTRIX/CEREB Grand_Tests.html"
  },
  {
    "title": "Clash of the Toppers Prof-1 - 2023-10-02",
    "file": "Clash_of_the_Toppers_Prof-1_-_2023-10-02.json",
    "questions": 30,
    "path": "./MEDTRIX/CEREB Grand_Tests.html"
  },
  {
    "title": "Clash of the Toppers Prof-2 - 2023-10-02",
    "file": "Clash_of_the_Toppers_Prof-2_-_2023-10-02.json",
    "questions": 30,
    "path": "./MEDTRIX/CEREB Grand_Tests.html"
  },
  {
    "title": "Clash of the Toppers Prof-3 - 2023-10-02",
    "file": "Clash_of_the_Toppers_Prof-3_-_2023-10-02.json",
    "questions": 30,
    "path": "./MEDTRIX/CEREB Grand_Tests.html"
  },
  {
    "title": "Clash of the Toppers Prof-4 - 2023-10-02",
    "file": "Clash_of_the_Toppers_Prof-4_-_2023-10-02.json",
    "questions": 30,
    "path": "./MEDTRIX/CEREB Grand_Tests.html"
  },
  {
    "title": "Demo Test for First Prof Students - 2024-12-20",
    "file": "Demo_Test_for_First_Prof_Students_-_2024-12-20.json",
    "questions": 30,
    "path": "./MEDTRIX/CEREB Grand_Tests.html"
  },
  {
    "title": "Elimination Round - 2023-10-02",
    "file": "Elimination_Round_-_2023-10-02.json",
    "questions": 50,
    "path": "./MEDTRIX/CEREB Grand_Tests.html"
  },
  {
    "title": "Exclusively for 1st Prof Students - 24-11-2024 - 2024-11-24",
    "file": "Exclusively_for_1st_Prof_Students_-_24-11-2024_-_2024-11-24.json",
    "questions": 30,
    "path": "./MEDTRIX/CEREB Grand_Tests.html"
  },
  {
    "title": "INICET Grand Test - 1 - 2023-04-16",
    "file": "INICET_Grand_Test_-_1_-_2023-04-16.json",
    "questions": 200,
    "path": "./MEDTRIX/CEREB Grand_Tests.html"
  },
  {
    "title": "INICET Grand Test - 2 - 2023-04-30",
    "file": "INICET_Grand_Test_-_2_-_2023-04-30.json",
    "questions": 200,
    "path": "./MEDTRIX/CEREB Grand_Tests.html"
  },
  {
    "title": "INICET Grand Test - 3 - 2023-10-26",
    "file": "INICET_Grand_Test_-_3_-_2023-10-26.json",
    "questions": 200,
    "path": "./MEDTRIX/CEREB Grand_Tests.html"
  },
  {
    "title": "INICET MOCK Test-1 - 27-04-2025 - 2025-04-27",
    "file": "INICET_MOCK_Test-1_-_27-04-2025_-_2025-04-27.json",
    "questions": 200,
    "path": "./MEDTRIX/CEREB Grand_Tests.html"
  },
  {
    "title": "INICET MOCK Test-2 - 03-05-2025 - 2025-05-03",
    "file": "INICET_MOCK_Test-2_-_03-05-2025_-_2025-05-03.json",
    "questions": 200,
    "path": "./MEDTRIX/CEREB Grand_Tests.html"
  },
  {
    "title": "INICET May 2024 Mock Test-1 (Part-1) - 19-04-2024 - 2024-04-19",
    "file": "INICET_May_2024_Mock_Test-1_Part-1_-_19-04-2024_-_2024-04-19.json",
    "questions": 50,
    "path": "./MEDTRIX/CEREB Grand_Tests.html"
  },
  {
    "title": "INICET May 2024 Mock Test-1 (Part-2) - 19-04-2024 - 2024-04-19",
    "file": "INICET_May_2024_Mock_Test-1_Part-2_-_19-04-2024_-_2024-04-19.json",
    "questions": 50,
    "path": "./MEDTRIX/CEREB Grand_Tests.html"
  },
  {
    "title": "INICET May 2024 Mock Test-1 (Part-3) - 19-04-2024 - 2024-04-19",
    "file": "INICET_May_2024_Mock_Test-1_Part-3_-_19-04-2024_-_2024-04-19.json",
    "questions": 50,
    "path": "./MEDTRIX/CEREB Grand_Tests.html"
  },
  {
    "title": "INICET May 2024 Mock Test-1 (Part-4) - 19-04-2024 - 2024-04-19",
    "file": "INICET_May_2024_Mock_Test-1_Part-4_-_19-04-2024_-_2024-04-19.json",
    "questions": 50,
    "path": "./MEDTRIX/CEREB Grand_Tests.html"
  },
  {
    "title": "INICET May 2024 Mock Test-2 (Part-1) - 28-04-2024 - 2024-04-28",
    "file": "INICET_May_2024_Mock_Test-2_Part-1_-_28-04-2024_-_2024-04-28.json",
    "questions": 50,
    "path": "./MEDTRIX/CEREB Grand_Tests.html"
  },
  {
    "title": "INICET May 2024 Mock Test-2 (Part-2) - 28-04-2024 - 2024-04-28",
    "file": "INICET_May_2024_Mock_Test-2_Part-2_-_28-04-2024_-_2024-04-28.json",
    "questions": 50,
    "path": "./MEDTRIX/CEREB Grand_Tests.html"
  },
  {
    "title": "INICET May 2024 Mock Test-2 (Part-3) - 28-04-2024 - 2024-04-28",
    "file": "INICET_May_2024_Mock_Test-2_Part-3_-_28-04-2024_-_2024-04-28.json",
    "questions": 50,
    "path": "./MEDTRIX/CEREB Grand_Tests.html"
  },
  {
    "title": "INICET May 2024 Mock Test-2 (Part-4) - 28-04-2024 - 2024-04-28",
    "file": "INICET_May_2024_Mock_Test-2_Part-4_-_28-04-2024_-_2024-04-28.json",
    "questions": 50,
    "path": "./MEDTRIX/CEREB Grand_Tests.html"
  },
  {
    "title": "INICET May 2024 Mock Test-3 (Part-1) - 12-05-2024 - 2024-05-12",
    "file": "INICET_May_2024_Mock_Test-3_Part-1_-_12-05-2024_-_2024-05-12.json",
    "questions": 50,
    "path": "./MEDTRIX/CEREB Grand_Tests.html"
  },
  {
    "title": "INICET May 2024 Mock Test-3 (Part-2) - 12-05-2024 - 2024-05-12",
    "file": "INICET_May_2024_Mock_Test-3_Part-2_-_12-05-2024_-_2024-05-12.json",
    "questions": 50,
    "path": "./MEDTRIX/CEREB Grand_Tests.html"
  },
  {
    "title": "INICET May 2024 Mock Test-3 (Part-3) - 12-05-2024 - 2024-05-12",
    "file": "INICET_May_2024_Mock_Test-3_Part-3_-_12-05-2024_-_2024-05-12.json",
    "questions": 50,
    "path": "./MEDTRIX/CEREB Grand_Tests.html"
  },
  {
    "title": "INICET May 2024 Mock Test-3 (Part-4) - 12-05-2024 - 2024-05-12",
    "file": "INICET_May_2024_Mock_Test-3_Part-4_-_12-05-2024_-_2024-05-12.json",
    "questions": 50,
    "path": "./MEDTRIX/CEREB Grand_Tests.html"
  },
  {
    "title": "INICET Nov 2024 Mock Test-1 - 19-10-2024 - 2024-10-19",
    "file": "INICET_Nov_2024_Mock_Test-1_-_19-10-2024_-_2024-10-19.json",
    "questions": 200,
    "path": "./MEDTRIX/CEREB Grand_Tests.html"
  },
  {
    "title": "INICET Nov 2024 Mock Test-2 - 27-10-2024 - 2024-10-27",
    "file": "INICET_Nov_2024_Mock_Test-2_-_27-10-2024_-_2024-10-27.json",
    "questions": 200,
    "path": "./MEDTRIX/CEREB Grand_Tests.html"
  },
  {
    "title": "Mission NEET PG-INICET Grand Test-15 - 16-06-2024 - 2024-06-16",
    "file": "Mission_NEET_PG-INICET_Grand_Test-15_-_16-06-2024_-_2024-06-16.json",
    "questions": 200,
    "path": "./MEDTRIX/CEREB Grand_Tests.html"
  },
  {
    "title": "Mission NEET PG-INICET Grand Test-16 - 03-07-2024 - 2024-07-03",
    "file": "Mission_NEET_PG-INICET_Grand_Test-16_-_03-07-2024_-_2024-07-03.json",
    "questions": 200,
    "path": "./MEDTRIX/CEREB Grand_Tests.html"
  },
  {
    "title": "Mission NEET PG-INICET Grand Test-17- 29-09-2024 - 2024-09-29",
    "file": "Mission_NEET_PG-INICET_Grand_Test-17-_29-09-2024_-_2024-09-29.json",
    "questions": 200,
    "path": "./MEDTRIX/CEREB Grand_Tests.html"
  },
  {
    "title": "Mission NEET PG-INICET Grand Test-18 - 20-11-2024 - 2024-11-20",
    "file": "Mission_NEET_PG-INICET_Grand_Test-18_-_20-11-2024_-_2024-11-20.json",
    "questions": 200,
    "path": "./MEDTRIX/CEREB Grand_Tests.html"
  },
  {
    "title": "Mission NEET PG-INICET Grand Test-19 - 16-12-2024 - 2024-12-16",
    "file": "Mission_NEET_PG-INICET_Grand_Test-19_-_16-12-2024_-_2024-12-16.json",
    "questions": 200,
    "path": "./MEDTRIX/CEREB Grand_Tests.html"
  },
  {
    "title": "Mission NEET PG-INICET Grand Test-20 - 29-12-2024 - 2024-12-29",
    "file": "Mission_NEET_PG-INICET_Grand_Test-20_-_29-12-2024_-_2024-12-29.json",
    "questions": 200,
    "path": "./MEDTRIX/CEREB Grand_Tests.html"
  },
  {
    "title": "Mission NEET PG-INICET Grand Test-21 - 13-01-2025 - 2025-01-13",
    "file": "Mission_NEET_PG-INICET_Grand_Test-21_-_13-01-2025_-_2025-01-13.json",
    "questions": 200,
    "path": "./MEDTRIX/CEREB Grand_Tests.html"
  },
  {
    "title": "Mission NEET PG-INICET Grand Test-22 - 31-01-2025 - 2025-01-31",
    "file": "Mission_NEET_PG-INICET_Grand_Test-22_-_31-01-2025_-_2025-01-31.json",
    "questions": 200,
    "path": "./MEDTRIX/CEREB Grand_Tests.html"
  },
  {
    "title": "Mission NEET PG-INICET Grand Test-23 - 14-02-2025 - 2025-02-14",
    "file": "Mission_NEET_PG-INICET_Grand_Test-23_-_14-02-2025_-_2025-02-14.json",
    "questions": 200,
    "path": "./MEDTRIX/CEREB Grand_Tests.html"
  },
  {
    "title": "Mission NEET PG-INICET Grand Test-24 - 28-02-2025 - 2025-02-28",
    "file": "Mission_NEET_PG-INICET_Grand_Test-24_-_28-02-2025_-_2025-02-28.json",
    "questions": 200,
    "path": "./MEDTRIX/CEREB Grand_Tests.html"
  },
  {
    "title": "Mission NEET PG-INICET Grand Test-25 - 10-03-2025 - 2025-03-10",
    "file": "Mission_NEET_PG-INICET_Grand_Test-25_-_10-03-2025_-_2025-03-10.json",
    "questions": 200,
    "path": "./MEDTRIX/CEREB Grand_Tests.html"
  },
  {
    "title": "Mission NEET PG-INICET Grand Test-26 - 29-03-2025 - 2025-03-29",
    "file": "Mission_NEET_PG-INICET_Grand_Test-26_-_29-03-2025_-_2025-03-29.json",
    "questions": 200,
    "path": "./MEDTRIX/CEREB Grand_Tests.html"
  },
  {
    "title": "Mission NEET PG-INICET Grand Test-27 - 18-04-2025 - 2025-04-18",
    "file": "Mission_NEET_PG-INICET_Grand_Test-27_-_18-04-2025_-_2025-04-18.json",
    "questions": 200,
    "path": "./MEDTRIX/CEREB Grand_Tests.html"
  },
  {
    "title": "Mission NEETPG_INICET GT - 1 - 2023-06-25",
    "file": "Mission_NEETPG_INICET_GT_-_1_-_2023-06-25.json",
    "questions": 200,
    "path": "./MEDTRIX/CEREB Grand_Tests.html"
  },
  {
    "title": "Mission NEETPG_INICET GT - 10 - 2024-02-19",
    "file": "Mission_NEETPG_INICET_GT_-_10_-_2024-02-19.json",
    "questions": 200,
    "path": "./MEDTRIX/CEREB Grand_Tests.html"
  },
  {
    "title": "Mission NEETPG_INICET GT - 11 - 2024-03-03",
    "file": "Mission_NEETPG_INICET_GT_-_11_-_2024-03-03.json",
    "questions": 200,
    "path": "./MEDTRIX/CEREB Grand_Tests.html"
  },
  {
    "title": "Mission NEETPG_INICET GT - 12 - 2024-03-17",
    "file": "Mission_NEETPG_INICET_GT_-_12_-_2024-03-17.json",
    "questions": 200,
    "path": "./MEDTRIX/CEREB Grand_Tests.html"
  },
  {
    "title": "Mission NEETPG_INICET GT - 13 - 2024-04-08",
    "file": "Mission_NEETPG_INICET_GT_-_13_-_2024-04-08.json",
    "questions": 200,
    "path": "./MEDTRIX/CEREB Grand_Tests.html"
  },
  {
    "title": "Mission NEETPG_INICET GT - 14 - 2024-05-05",
    "file": "Mission_NEETPG_INICET_GT_-_14_-_2024-05-05.json",
    "questions": 200,
    "path": "./MEDTRIX/CEREB Grand_Tests.html"
  },
  {
    "title": "Mission NEETPG_INICET GT - 15 - 2024-05-27",
    "file": "Mission_NEETPG_INICET_GT_-_15_-_2024-05-27.json",
    "questions": 200,
    "path": "./MEDTRIX/CEREB Grand_Tests.html"
  },
  {
    "title": "Mission NEETPG_INICET GT - 2 - 2023-08-06",
    "file": "Mission_NEETPG_INICET_GT_-_2_-_2023-08-06.json",
    "questions": 200,
    "path": "./MEDTRIX/CEREB Grand_Tests.html"
  },
  {
    "title": "Mission NEETPG_INICET GT - 3 - 2023-09-03",
    "file": "Mission_NEETPG_INICET_GT_-_3_-_2023-09-03.json",
    "questions": 200,
    "path": "./MEDTRIX/CEREB Grand_Tests.html"
  },
  {
    "title": "Mission NEETPG_INICET GT - 4 - 2023-10-08",
    "file": "Mission_NEETPG_INICET_GT_-_4_-_2023-10-08.json",
    "questions": 200,
    "path": "./MEDTRIX/CEREB Grand_Tests.html"
  },
  {
    "title": "Mission NEETPG_INICET GT - 5 - 2023-12-01",
    "file": "Mission_NEETPG_INICET_GT_-_5_-_2023-12-01.json",
    "questions": 200,
    "path": "./MEDTRIX/CEREB Grand_Tests.html"
  },
  {
    "title": "Mission NEETPG_INICET GT - 6 - 2023-12-18",
    "file": "Mission_NEETPG_INICET_GT_-_6_-_2023-12-18.json",
    "questions": 200,
    "path": "./MEDTRIX/CEREB Grand_Tests.html"
  },
  {
    "title": "Mission NEETPG_INICET GT - 7 - 2024-01-05",
    "file": "Mission_NEETPG_INICET_GT_-_7_-_2024-01-05.json",
    "questions": 200,
    "path": "./MEDTRIX/CEREB Grand_Tests.html"
  },
  {
    "title": "Mission NEETPG_INICET GT - 8 - 2024-01-21",
    "file": "Mission_NEETPG_INICET_GT_-_8_-_2024-01-21.json",
    "questions": 200,
    "path": "./MEDTRIX/CEREB Grand_Tests.html"
  },
  {
    "title": "Mission NEETPG_INICET GT - 9 - 2024-02-04",
    "file": "Mission_NEETPG_INICET_GT_-_9_-_2024-02-04.json",
    "questions": 200,
    "path": "./MEDTRIX/CEREB Grand_Tests.html"
  },
  {
    "title": "NEET Mock with Video Solutions - 11-07-2024 - 2024-07-11",
    "file": "NEET_Mock_with_Video_Solutions_-_11-07-2024_-_2024-07-11.json",
    "questions": 200,
    "path": "./MEDTRIX/CEREB Grand_Tests.html"
  },
  {
    "title": "NEET PG PYQ BASED MOCK TEST - 30-07-2024 - 2024-07-30",
    "file": "NEET_PG_PYQ_BASED_MOCK_TEST_-_30-07-2024_-_2024-07-30.json",
    "questions": 200,
    "path": "./MEDTRIX/CEREB Grand_Tests.html"
  },
  {
    "title": "NEET PG_INI-CET BASELINE GRAND TEST - 31-08-2024 - 2024-08-31",
    "file": "NEET_PG_INI-CET_BASELINE_GRAND_TEST_-_31-08-2024_-_2024-08-31.json",
    "questions": 200,
    "path": "./MEDTRIX/CEREB Grand_Tests.html"
  },
  {
    "title": "NEETPG June 2024 Mock Test-1 - 10-06-2024 - 2024-06-10",
    "file": "NEETPG_June_2024_Mock_Test-1_-_10-06-2024_-_2024-06-10.json",
    "questions": 200,
    "path": "./MEDTRIX/CEREB Grand_Tests.html"
  },
  {
    "title": "NEETPG Mock-1 (Advanced Difficulty) - 22-05-2025 - 2025-05-22",
    "file": "NEETPG_Mock-1_Advanced_Difficulty_-_22-05-2025_-_2025-05-22.json",
    "questions": 200,
    "path": "./MEDTRIX/CEREB Grand_Tests.html"
  },
  {
    "title": "NEETPG Mock-2 (Standard Difficulty) - 30-05-2025 - 2025-05-30",
    "file": "NEETPG_Mock-2_Standard_Difficulty_-_30-05-2025_-_2025-05-30.json",
    "questions": 200,
    "path": "./MEDTRIX/CEREB Grand_Tests.html"
  },
  {
    "title": "NEETPG Mock-3 (Standard Difficulty) - 15-06-2025 - 2025-06-15",
    "file": "NEETPG_Mock-3_Standard_Difficulty_-_15-06-2025_-_2025-06-15.json",
    "questions": 200,
    "path": "./MEDTRIX/CEREB Grand_Tests.html"
  },
  {
    "title": "NEETPG Mock-4 (Standard Difficulty) - 02-07-2025 - 2025-07-02",
    "file": "NEETPG_Mock-4_Standard_Difficulty_-_02-07-2025_-_2025-07-02.json",
    "questions": 200,
    "path": "./MEDTRIX/CEREB Grand_Tests.html"
  },
  {
    "title": "Abdominal Trauma",
    "file": "Abdominal_Trauma.json",
    "questions": 19,
    "path": "./MEDTRIX/surgery_e_qb.html"
  },
  {
    "title": "Acute & Chronic Limb Ischemia (Part 1)",
    "file": "Acute__Chronic_Limb_Ischemia_Part_1.json",
    "questions": 25,
    "path": "./MEDTRIX/surgery_e_qb.html"
  },
  {
    "title": "Adrenal Gland (Adrenal Cortex Neoplasm & Pheochromocytoma)",
    "file": "Adrenal_Gland_Adrenal_Cortex_Neoplasm__Pheochromocytoma.json",
    "questions": 14,
    "path": "./MEDTRIX/surgery_e_qb.html"
  },
  {
    "title": "Anal Canal & It\u2019s Common Conditions",
    "file": "Anal_Canal__Its_Common_Conditions.json",
    "questions": 18,
    "path": "./MEDTRIX/surgery_e_qb.html"
  },
  {
    "title": "Anatomy & Physiology of Lymphatic System",
    "file": "Anatomy__Physiology_of_Lymphatic_System.json",
    "questions": 2,
    "path": "./MEDTRIX/surgery_e_qb.html"
  },
  {
    "title": "Aneurysm _ Av Malformation _ Amputation (Part 2)",
    "file": "Aneurysm___Av_Malformation___Amputation_Part_2.json",
    "questions": 17,
    "path": "./MEDTRIX/surgery_e_qb.html"
  },
  {
    "title": "Appendix",
    "file": "Appendix.json",
    "questions": 32,
    "path": "./MEDTRIX/surgery_e_qb.html"
  },
  {
    "title": "Approach to Breast Lump",
    "file": "Approach_to_Breast_Lump.json",
    "questions": 14,
    "path": "./MEDTRIX/surgery_e_qb.html"
  },
  {
    "title": "Basic Pathophysiology of Trauma & Stress (Part 1)",
    "file": "Basic_Pathophysiology_of_Trauma__Stress_Part_1.json",
    "questions": 7,
    "path": "./MEDTRIX/surgery_e_qb.html"
  },
  {
    "title": "Benign Disorders of Breast",
    "file": "Benign_Disorders_of_Breast.json",
    "questions": 19,
    "path": "./MEDTRIX/surgery_e_qb.html"
  },
  {
    "title": "Brain Tumors",
    "file": "Brain_Tumors.json",
    "questions": 11,
    "path": "./MEDTRIX/surgery_e_qb.html"
  },
  {
    "title": "Burns",
    "file": "Burns.json",
    "questions": 12,
    "path": "./MEDTRIX/surgery_e_qb.html"
  },
  {
    "title": "Carcinoma Lung & Mediastinal Conditions (Part 3)",
    "file": "Carcinoma_Lung__Mediastinal_Conditions_Part_3.json",
    "questions": 14,
    "path": "./MEDTRIX/surgery_e_qb.html"
  },
  {
    "title": "Classification & Risk Factor",
    "file": "Classification__Risk_Factor.json",
    "questions": 13,
    "path": "./MEDTRIX/surgery_e_qb.html"
  },
  {
    "title": "Damage Control Resuscitation",
    "file": "Damage_Control_Resuscitation.json",
    "questions": 5,
    "path": "./MEDTRIX/surgery_e_qb.html"
  },
  {
    "title": "Damage Control Surgery",
    "file": "Damage_Control_Surgery.json",
    "questions": 12,
    "path": "./MEDTRIX/surgery_e_qb.html"
  },
  {
    "title": "Esophagus ( Gerd & Functional Disorders )",
    "file": "Esophagus__Gerd__Functional_Disorders.json",
    "questions": 22,
    "path": "./MEDTRIX/surgery_e_qb.html"
  },
  {
    "title": "Esophagus (Carcinoma Esophagus)",
    "file": "Esophagus_Carcinoma_Esophagus.json",
    "questions": 26,
    "path": "./MEDTRIX/surgery_e_qb.html"
  },
  {
    "title": "Esophagus (Esophageal Injury & Other Common Conditions)",
    "file": "Esophagus_Esophageal_Injury__Other_Common_Conditions.json",
    "questions": 18,
    "path": "./MEDTRIX/surgery_e_qb.html"
  },
  {
    "title": "Esophagus (Surgical Anatomy & Investigation)",
    "file": "Esophagus_Surgical_Anatomy__Investigation.json",
    "questions": 35,
    "path": "./MEDTRIX/surgery_e_qb.html"
  },
  {
    "title": "Gall Bladder (Choledocholithiasis & Bile Duct Injury)",
    "file": "Gall_Bladder_Choledocholithiasis__Bile_Duct_Injury.json",
    "questions": 25,
    "path": "./MEDTRIX/surgery_e_qb.html"
  },
  {
    "title": "Gall Bladder (Gall Bladder & Bile Duct Cancer)",
    "file": "Gall_Bladder_Gall_Bladder__Bile_Duct_Cancer.json",
    "questions": 17,
    "path": "./MEDTRIX/surgery_e_qb.html"
  },
  {
    "title": "Gall Bladder (Gall Stone Disease)",
    "file": "Gall_Bladder_Gall_Stone_Disease.json",
    "questions": 18,
    "path": "./MEDTRIX/surgery_e_qb.html"
  },
  {
    "title": "Gall Bladder (Surgical Anatomy & Investigations)",
    "file": "Gall_Bladder_Surgical_Anatomy__Investigations.json",
    "questions": 12,
    "path": "./MEDTRIX/surgery_e_qb.html"
  },
  {
    "title": "Head & Neck Trauma",
    "file": "Head__Neck_Trauma.json",
    "questions": 15,
    "path": "./MEDTRIX/surgery_e_qb.html"
  },
  {
    "title": "Hydrocephalus",
    "file": "Hydrocephalus.json",
    "questions": 8,
    "path": "./MEDTRIX/surgery_e_qb.html"
  },
  {
    "title": "IHD & Aortic Dissection (Part 2)",
    "file": "IHD__Aortic_Dissection_Part_2.json",
    "questions": 31,
    "path": "./MEDTRIX/surgery_e_qb.html"
  },
  {
    "title": "Inguinal Hernia",
    "file": "Inguinal_Hernia.json",
    "questions": 12,
    "path": "./MEDTRIX/surgery_e_qb.html"
  },
  {
    "title": "Investigation & Management",
    "file": "Investigation__Management.json",
    "questions": 10,
    "path": "./MEDTRIX/surgery_e_qb.html"
  },
  {
    "title": "Investigations",
    "file": "Investigations.json",
    "questions": 7,
    "path": "./MEDTRIX/surgery_e_qb.html"
  },
  {
    "title": "Kidney - Congenital & Other Benign Disorders (Part 3)",
    "file": "Kidney_-_Congenital__Other_Benign_Disorders_Part_3.json",
    "questions": 14,
    "path": "./MEDTRIX/surgery_e_qb.html"
  },
  {
    "title": "Kidney - Renal Neoplasm (Part 2)",
    "file": "Kidney_-_Renal_Neoplasm_Part_2.json",
    "questions": 15,
    "path": "./MEDTRIX/surgery_e_qb.html"
  },
  {
    "title": "Kidney - Urinary Tract Calculi (Part 1)",
    "file": "Kidney_-_Urinary_Tract_Calculi_Part_1.json",
    "questions": 14,
    "path": "./MEDTRIX/surgery_e_qb.html"
  },
  {
    "title": "Large Intestine (Colorectal Cancer)",
    "file": "Large_Intestine_Colorectal_Cancer.json",
    "questions": 23,
    "path": "./MEDTRIX/surgery_e_qb.html"
  },
  {
    "title": "Large Intestine (Common Large Intestinal Conditions)",
    "file": "Large_Intestine_Common_Large_Intestinal_Conditions.json",
    "questions": 23,
    "path": "./MEDTRIX/surgery_e_qb.html"
  },
  {
    "title": "Liver (Liver Failure & Portal Hypertension)",
    "file": "Liver_Liver_Failure__Portal_Hypertension.json",
    "questions": 12,
    "path": "./MEDTRIX/surgery_e_qb.html"
  },
  {
    "title": "Liver (Liver Infection & Neoplasm)",
    "file": "Liver_Liver_Infection__Neoplasm.json",
    "questions": 45,
    "path": "./MEDTRIX/surgery_e_qb.html"
  },
  {
    "title": "Lymphedema (Clinical Presentation)",
    "file": "Lymphedema_Clinical_Presentation.json",
    "questions": 11,
    "path": "./MEDTRIX/surgery_e_qb.html"
  },
  {
    "title": "Management (Part 1)",
    "file": "Management_Part_1.json",
    "questions": 5,
    "path": "./MEDTRIX/surgery_e_qb.html"
  },
  {
    "title": "Management (Part 2)",
    "file": "Management_Part_2.json",
    "questions": 14,
    "path": "./MEDTRIX/surgery_e_qb.html"
  },
  {
    "title": "Management (Part 3)",
    "file": "Management_Part_3.json",
    "questions": 10,
    "path": "./MEDTRIX/surgery_e_qb.html"
  },
  {
    "title": "Management (Part 4)",
    "file": "Management_Part_4.json",
    "questions": 25,
    "path": "./MEDTRIX/surgery_e_qb.html"
  },
  {
    "title": "Metabolic Surgery",
    "file": "Metabolic_Surgery.json",
    "questions": 16,
    "path": "./MEDTRIX/surgery_e_qb.html"
  },
  {
    "title": "Minimal Access Surgery & Staplers (Part 3)",
    "file": "Minimal_Access_Surgery__Staplers_Part_3.json",
    "questions": 44,
    "path": "./MEDTRIX/surgery_e_qb.html"
  },
  {
    "title": "Neuroendocrine (Endocrine Neoplasm of Pancreas & Carcinoid Tumour)",
    "file": "Neuroendocrine_Endocrine_Neoplasm_of_Pancreas__Carcinoid_Tumour.json",
    "questions": 18,
    "path": "./MEDTRIX/surgery_e_qb.html"
  },
  {
    "title": "Nutrition (Part 2)",
    "file": "Nutrition_Part_2.json",
    "questions": 37,
    "path": "./MEDTRIX/surgery_e_qb.html"
  },
  {
    "title": "Oral Cavity",
    "file": "Oral_Cavity.json",
    "questions": 26,
    "path": "./MEDTRIX/surgery_e_qb.html"
  },
  {
    "title": "Pancreas (Anomalies & Inflammation)",
    "file": "Pancreas_Anomalies__Inflammation.json",
    "questions": 16,
    "path": "./MEDTRIX/surgery_e_qb.html"
  },
  {
    "title": "Pancreas (Management of Acute & Chronic Pancreatitis)",
    "file": "Pancreas_Management_of_Acute__Chronic_Pancreatitis.json",
    "questions": 53,
    "path": "./MEDTRIX/surgery_e_qb.html"
  },
  {
    "title": "Pancreas (Pancreatic Neoplasm)",
    "file": "Pancreas_Pancreatic_Neoplasm.json",
    "questions": 19,
    "path": "./MEDTRIX/surgery_e_qb.html"
  },
  {
    "title": "Parathyroid - Basic Physiology & Primary Hyperparathyroidism (Part 1)",
    "file": "Parathyroid_-_Basic_Physiology__Primary_Hyperparathyroidism_Part_1.json",
    "questions": 17,
    "path": "./MEDTRIX/surgery_e_qb.html"
  },
  {
    "title": "Parathyroid - Secondary & Tertiary Hyperparathyroidism (Part 2)",
    "file": "Parathyroid_-_Secondary__Tertiary_Hyperparathyroidism_Part_2.json",
    "questions": 7,
    "path": "./MEDTRIX/surgery_e_qb.html"
  },
  {
    "title": "Pediatric Surgery",
    "file": "Pediatric_Surgery.json",
    "questions": 4,
    "path": "./MEDTRIX/surgery_e_qb.html"
  },
  {
    "title": "Plastic Surgery - Flaps & Reconstruction (Part 2)",
    "file": "Plastic_Surgery_-_Flaps__Reconstruction_Part_2.json",
    "questions": 9,
    "path": "./MEDTRIX/surgery_e_qb.html"
  },
  {
    "title": "Plastic Surgery - Skin Grafting (Part 1)",
    "file": "Plastic_Surgery_-_Skin_Grafting_Part_1.json",
    "questions": 7,
    "path": "./MEDTRIX/surgery_e_qb.html"
  },
  {
    "title": "Pleural Diseases & Thoracic Outlet Syndrome (Part 2)",
    "file": "Pleural_Diseases__Thoracic_Outlet_Syndrome_Part_2.json",
    "questions": 16,
    "path": "./MEDTRIX/surgery_e_qb.html"
  },
  {
    "title": "Pre & Post Operative Care (Part 5)",
    "file": "Pre__Post_Operative_Care_Part_5.json",
    "questions": 30,
    "path": "./MEDTRIX/surgery_e_qb.html"
  },
  {
    "title": "Primary Survey",
    "file": "Primary_Survey.json",
    "questions": 12,
    "path": "./MEDTRIX/surgery_e_qb.html"
  },
  {
    "title": "Prognosis",
    "file": "Prognosis.json",
    "questions": 6,
    "path": "./MEDTRIX/surgery_e_qb.html"
  },
  {
    "title": "Prostate",
    "file": "Prostate.json",
    "questions": 26,
    "path": "./MEDTRIX/surgery_e_qb.html"
  },
  {
    "title": "Retroperitoneal Trauma",
    "file": "Retroperitoneal_Trauma.json",
    "questions": 14,
    "path": "./MEDTRIX/surgery_e_qb.html"
  },
  {
    "title": "SAH",
    "file": "SAH.json",
    "questions": 6,
    "path": "./MEDTRIX/surgery_e_qb.html"
  },
  {
    "title": "Salivary Glands",
    "file": "Salivary_Glands.json",
    "questions": 1,
    "path": "./MEDTRIX/surgery_e_qb.html"
  },
  {
    "title": "Shock & Sepsis (Part 6)",
    "file": "Shock__Sepsis_Part_6.json",
    "questions": 34,
    "path": "./MEDTRIX/surgery_e_qb.html"
  },
  {
    "title": "Skin & Subcutaneous Tissue (Skin Tumors & Common Skin Conditions)",
    "file": "Skin__Subcutaneous_Tissue_Skin_Tumors__Common_Skin_Conditions.json",
    "questions": 19,
    "path": "./MEDTRIX/surgery_e_qb.html"
  },
  {
    "title": "Small Intestine (Intestinal Obstruction)",
    "file": "Small_Intestine_Intestinal_Obstruction.json",
    "questions": 11,
    "path": "./MEDTRIX/surgery_e_qb.html"
  },
  {
    "title": "Small Intestine (Various Common Small Intestinal Conditions)",
    "file": "Small_Intestine_Various_Common_Small_Intestinal_Conditions.json",
    "questions": 41,
    "path": "./MEDTRIX/surgery_e_qb.html"
  },
  {
    "title": "Spleen",
    "file": "Spleen.json",
    "questions": 17,
    "path": "./MEDTRIX/surgery_e_qb.html"
  },
  {
    "title": "Staging of Carcinoma Breast",
    "file": "Staging_of_Carcinoma_Breast.json",
    "questions": 12,
    "path": "./MEDTRIX/surgery_e_qb.html"
  },
  {
    "title": "Stomach (Carcinoma Stomach)",
    "file": "Stomach_Carcinoma_Stomach.json",
    "questions": 5,
    "path": "./MEDTRIX/surgery_e_qb.html"
  },
  {
    "title": "Stomach (Gist & Other Common Conditions)",
    "file": "Stomach_Gist__Other_Common_Conditions.json",
    "questions": 15,
    "path": "./MEDTRIX/surgery_e_qb.html"
  },
  {
    "title": "Stomach (Surgical Anatomy & Stomach Surgeries)",
    "file": "Stomach_Surgical_Anatomy__Stomach_Surgeries.json",
    "questions": 4,
    "path": "./MEDTRIX/surgery_e_qb.html"
  },
  {
    "title": "Stomach (Ulcer Diseases)",
    "file": "Stomach_Ulcer_Diseases.json",
    "questions": 28,
    "path": "./MEDTRIX/surgery_e_qb.html"
  },
  {
    "title": "Stomach (Upper GI Bleed)",
    "file": "Stomach_Upper_GI_Bleed.json",
    "questions": 14,
    "path": "./MEDTRIX/surgery_e_qb.html"
  },
  {
    "title": "Surgical Anatomy & Cardiopulmonary Bypass (Part 1)",
    "file": "Surgical_Anatomy__Cardiopulmonary_Bypass_Part_1.json",
    "questions": 22,
    "path": "./MEDTRIX/surgery_e_qb.html"
  },
  {
    "title": "Surgical Anatomy & Investigations (Part 1)",
    "file": "Surgical_Anatomy__Investigations_Part_1.json",
    "questions": 12,
    "path": "./MEDTRIX/surgery_e_qb.html"
  },
  {
    "title": "Surgical Anatomy",
    "file": "Surgical_Anatomy.json",
    "questions": 13,
    "path": "./MEDTRIX/surgery_e_qb.html"
  },
  {
    "title": "Surgical Incisions, Sutures & Needles (Part 1)",
    "file": "Surgical_Incisions_Sutures__Needles_Part_1.json",
    "questions": 16,
    "path": "./MEDTRIX/surgery_e_qb.html"
  },
  {
    "title": "Surgical Site Infection (Part 4)",
    "file": "Surgical_Site_Infection_Part_4.json",
    "questions": 26,
    "path": "./MEDTRIX/surgery_e_qb.html"
  },
  {
    "title": "Testis",
    "file": "Testis.json",
    "questions": 22,
    "path": "./MEDTRIX/surgery_e_qb.html"
  },
  {
    "title": "Thoracic Trauma",
    "file": "Thoracic_Trauma.json",
    "questions": 5,
    "path": "./MEDTRIX/surgery_e_qb.html"
  },
  {
    "title": "Thyroid - Benign Thyroid Disorders (Part 2)",
    "file": "Thyroid_-_Benign_Thyroid_Disorders_Part_2.json",
    "questions": 16,
    "path": "./MEDTRIX/surgery_e_qb.html"
  },
  {
    "title": "Thyroid - Surgical Anatomy & Investigations (Part 1)",
    "file": "Thyroid_-_Surgical_Anatomy__Investigations_Part_1.json",
    "questions": 14,
    "path": "./MEDTRIX/surgery_e_qb.html"
  },
  {
    "title": "Thyroid - Thyroid Neoplasm (Part 3)",
    "file": "Thyroid_-_Thyroid_Neoplasm_Part_3.json",
    "questions": 23,
    "path": "./MEDTRIX/surgery_e_qb.html"
  },
  {
    "title": "Transplant",
    "file": "Transplant.json",
    "questions": 16,
    "path": "./MEDTRIX/surgery_e_qb.html"
  },
  {
    "title": "Triage",
    "file": "Triage.json",
    "questions": 1,
    "path": "./MEDTRIX/surgery_e_qb.html"
  },
  {
    "title": "Types Of Closure _ Knots & Energy Sources (Part 2)",
    "file": "Types_Of_Closure___Knots__Energy_Sources_Part_2.json",
    "questions": 31,
    "path": "./MEDTRIX/surgery_e_qb.html"
  },
  {
    "title": "Urethra & Penis",
    "file": "Urethra__Penis.json",
    "questions": 17,
    "path": "./MEDTRIX/surgery_e_qb.html"
  },
  {
    "title": "Urinary Bladder - Benign & Malignant Disorders (Part 2)",
    "file": "Urinary_Bladder_-_Benign__Malignant_Disorders_Part_2.json",
    "questions": 15,
    "path": "./MEDTRIX/surgery_e_qb.html"
  },
  {
    "title": "Urinary Bladder - Urinary Diversion, Retention of Urine & Incontinence (Part 1)",
    "file": "Urinary_Bladder_-_Urinary_Diversion_Retention_of_Urine__Incontinence_Part_1.json",
    "questions": 9,
    "path": "./MEDTRIX/surgery_e_qb.html"
  },
  {
    "title": "Varicose Vein",
    "file": "Varicose_Vein.json",
    "questions": 10,
    "path": "./MEDTRIX/surgery_e_qb.html"
  },
  {
    "title": "Venous Thrombosis",
    "file": "Venous_Thrombosis.json",
    "questions": 42,
    "path": "./MEDTRIX/surgery_e_qb.html"
  },
  {
    "title": "Ventral & Other Types of Hernias",
    "file": "Ventral__Other_Types_of_Hernias.json",
    "questions": 11,
    "path": "./MEDTRIX/surgery_e_qb.html"
  },
  {
    "title": "Wound Healing & Infection (Part 3)",
    "file": "Wound_Healing__Infection_Part_3.json",
    "questions": 9,
    "path": "./MEDTRIX/surgery_e_qb.html"
  },
  {
    "title": "Amino_Acid_and_Protein_Metabolism-Previous_Year_Questions",
    "file": "Amino_Acid_and_Protein_Metabolism-Previous_Year_Questions.json",
    "questions": 5,
    "path": "./MEDTRIX/prepx_Biochemistry.html"
  },
  {
    "title": "Amino_Acids_Metabolism-Previous_Year_Questions",
    "file": "Amino_Acids_Metabolism-Previous_Year_Questions.json",
    "questions": 21,
    "path": "./MEDTRIX/prepx_Biochemistry.html"
  },
  {
    "title": "Amino_Acids_and_Proteins_Chemistry-Amino_acid_Catabolism__Urea_cycle_and_Hyperammonemia",
    "file": "Amino_Acids_and_Proteins_Chemistry-Amino_acid_Catabolism__Urea_cycle_and_Hyperammonemia.json",
    "questions": 26,
    "path": "./MEDTRIX/prepx_Biochemistry.html"
  },
  {
    "title": "Amino_Acids_and_Proteins_Chemistry-Phenylalanine___Tyrosine__Amino_Acid_Metabolism_disorders",
    "file": "Amino_Acids_and_Proteins_Chemistry-Phenylalanine___Tyrosine__Amino_Acid_Metabolism_disorders.json",
    "questions": 19,
    "path": "./MEDTRIX/prepx_Biochemistry.html"
  },
  {
    "title": "Amino_Acids_and_Proteins_Chemistry-Previous_Year_Questions",
    "file": "Amino_Acids_and_Proteins_Chemistry-Previous_Year_Questions.json",
    "questions": 54,
    "path": "./MEDTRIX/prepx_Biochemistry.html"
  },
  {
    "title": "Amino_Acids_and_Proteins_Chemistry-Protein_Chemistry__Hemoglobin__Myoglobin___EPP_Chromatography",
    "file": "Amino_Acids_and_Proteins_Chemistry-Protein_Chemistry__Hemoglobin__Myoglobin___EPP_Chromatography.json",
    "questions": 25,
    "path": "./MEDTRIX/prepx_Biochemistry.html"
  },
  {
    "title": "Biochemistry-Previous_Year_Questions",
    "file": "Biochemistry-Previous_Year_Questions.json",
    "questions": 2,
    "path": "./MEDTRIX/prepx_Biochemistry.html"
  },
  {
    "title": "Carbohydrate_Chemistry-Carbohydrates",
    "file": "Carbohydrate_Chemistry-Carbohydrates.json",
    "questions": 24,
    "path": "./MEDTRIX/prepx_Biochemistry.html"
  },
  {
    "title": "Carbohydrate_Chemistry-Citric_Acid_cycle_and_Gluconeogenesis",
    "file": "Carbohydrate_Chemistry-Citric_Acid_cycle_and_Gluconeogenesis.json",
    "questions": 18,
    "path": "./MEDTRIX/prepx_Biochemistry.html"
  },
  {
    "title": "Carbohydrate_Chemistry-Fates_of_pyruvate__PDH_complex__Electron_Transport_Chain",
    "file": "Carbohydrate_Chemistry-Fates_of_pyruvate__PDH_complex__Electron_Transport_Chain.json",
    "questions": 13,
    "path": "./MEDTRIX/prepx_Biochemistry.html"
  },
  {
    "title": "Carbohydrate_Chemistry-Fructose_and_galactose_metabolism___HMP_pathway",
    "file": "Carbohydrate_Chemistry-Fructose_and_galactose_metabolism___HMP_pathway.json",
    "questions": 13,
    "path": "./MEDTRIX/prepx_Biochemistry.html"
  },
  {
    "title": "Carbohydrate_Chemistry-GLUT_transporters_and_Glycolysis",
    "file": "Carbohydrate_Chemistry-GLUT_transporters_and_Glycolysis.json",
    "questions": 12,
    "path": "./MEDTRIX/prepx_Biochemistry.html"
  },
  {
    "title": "Carbohydrate_Chemistry-Glycogen_Metabolism_and_Glycogen_Storage_Disorders",
    "file": "Carbohydrate_Chemistry-Glycogen_Metabolism_and_Glycogen_Storage_Disorders.json",
    "questions": 17,
    "path": "./MEDTRIX/prepx_Biochemistry.html"
  },
  {
    "title": "Carbohydrate_Chemistry-Previous_Year_Questions",
    "file": "Carbohydrate_Chemistry-Previous_Year_Questions.json",
    "questions": 29,
    "path": "./MEDTRIX/prepx_Biochemistry.html"
  },
  {
    "title": "Carbohydrate_Metabolism-Previous_Year_Questions",
    "file": "Carbohydrate_Metabolism-Previous_Year_Questions.json",
    "questions": 41,
    "path": "./MEDTRIX/prepx_Biochemistry.html"
  },
  {
    "title": "Clinical_Biochemistry-Previous_Year_Questions",
    "file": "Clinical_Biochemistry-Previous_Year_Questions.json",
    "questions": 21,
    "path": "./MEDTRIX/prepx_Biochemistry.html"
  },
  {
    "title": "Concepts-Previous_Year_Questions",
    "file": "Concepts-Previous_Year_Questions.json",
    "questions": 7,
    "path": "./MEDTRIX/prepx_Biochemistry.html"
  },
  {
    "title": "Enzymes-Enzymes",
    "file": "Enzymes-Enzymes.json",
    "questions": 25,
    "path": "./MEDTRIX/prepx_Biochemistry.html"
  },
  {
    "title": "Enzymes-Previous_Year_Questions",
    "file": "Enzymes-Previous_Year_Questions.json",
    "questions": 29,
    "path": "./MEDTRIX/prepx_Biochemistry.html"
  },
  {
    "title": "Genetics-Advanced_Molecular_Techniques__Recombinant_DNA_technology__Microarray__CRISPR__Lac_operon",
    "file": "Genetics-Advanced_Molecular_Techniques__Recombinant_DNA_technology__Microarray__CRISPR__Lac_operon.json",
    "questions": 18,
    "path": "./MEDTRIX/prepx_Biochemistry.html"
  },
  {
    "title": "Genetics-DNA_and_Chromosome_Biochemistry__Structure__Replication__and_Repair",
    "file": "Genetics-DNA_and_Chromosome_Biochemistry__Structure__Replication__and_Repair.json",
    "questions": 27,
    "path": "./MEDTRIX/prepx_Biochemistry.html"
  },
  {
    "title": "Genetics-PCR",
    "file": "Genetics-PCR.json",
    "questions": 11,
    "path": "./MEDTRIX/prepx_Biochemistry.html"
  },
  {
    "title": "Genetics-Previous_Year_Questions",
    "file": "Genetics-Previous_Year_Questions.json",
    "questions": 44,
    "path": "./MEDTRIX/prepx_Biochemistry.html"
  },
  {
    "title": "Genetics-RNA_Transcription__Genetic_code_mutation__Translation_inhibitors",
    "file": "Genetics-RNA_Transcription__Genetic_code_mutation__Translation_inhibitors.json",
    "questions": 20,
    "path": "./MEDTRIX/prepx_Biochemistry.html"
  },
  {
    "title": "Heme_Metabolism-Previous_Year_Questions",
    "file": "Heme_Metabolism-Previous_Year_Questions.json",
    "questions": 7,
    "path": "./MEDTRIX/prepx_Biochemistry.html"
  },
  {
    "title": "Heme_Synthesis-Heme_Synthesis_and_Porphyrias",
    "file": "Heme_Synthesis-Heme_Synthesis_and_Porphyrias.json",
    "questions": 10,
    "path": "./MEDTRIX/prepx_Biochemistry.html"
  },
  {
    "title": "Heme_Synthesis-Previous_Year_Questions",
    "file": "Heme_Synthesis-Previous_Year_Questions.json",
    "questions": 6,
    "path": "./MEDTRIX/prepx_Biochemistry.html"
  },
  {
    "title": "Introduction-Previous_Year_Questions",
    "file": "Introduction-Previous_Year_Questions.json",
    "questions": 5,
    "path": "./MEDTRIX/prepx_Biochemistry.html"
  },
  {
    "title": "Lipid_Chemistry-Cholesterol__Lipoproteins__and_Hypercholesterolemia",
    "file": "Lipid_Chemistry-Cholesterol__Lipoproteins__and_Hypercholesterolemia.json",
    "questions": 20,
    "path": "./MEDTRIX/prepx_Biochemistry.html"
  },
  {
    "title": "Lipid_Chemistry-Fatty_Acid_Synthesis_and_Oxidation",
    "file": "Lipid_Chemistry-Fatty_Acid_Synthesis_and_Oxidation.json",
    "questions": 16,
    "path": "./MEDTRIX/prepx_Biochemistry.html"
  },
  {
    "title": "Lipid_Chemistry-Lipid_Chemistry",
    "file": "Lipid_Chemistry-Lipid_Chemistry.json",
    "questions": 17,
    "path": "./MEDTRIX/prepx_Biochemistry.html"
  },
  {
    "title": "Lipid_Chemistry-Previous_Year_Questions",
    "file": "Lipid_Chemistry-Previous_Year_Questions.json",
    "questions": 20,
    "path": "./MEDTRIX/prepx_Biochemistry.html"
  },
  {
    "title": "Lipid_Metabolism-Previous_Year_Questions",
    "file": "Lipid_Metabolism-Previous_Year_Questions.json",
    "questions": 15,
    "path": "./MEDTRIX/prepx_Biochemistry.html"
  },
  {
    "title": "Minerals-Previous_Year_Questions",
    "file": "Minerals-Previous_Year_Questions.json",
    "questions": 5,
    "path": "./MEDTRIX/prepx_Biochemistry.html"
  },
  {
    "title": "Miscellaneous-Previous_Year_Questions",
    "file": "Miscellaneous-Previous_Year_Questions.json",
    "questions": 8,
    "path": "./MEDTRIX/prepx_Biochemistry.html"
  },
  {
    "title": "Oxidative_Phosphorylation-Previous_Year_Questions",
    "file": "Oxidative_Phosphorylation-Previous_Year_Questions.json",
    "questions": 2,
    "path": "./MEDTRIX/prepx_Biochemistry.html"
  },
  {
    "title": "Vitamins-Fat-soluble_vitamins",
    "file": "Vitamins-Fat-soluble_vitamins.json",
    "questions": 21,
    "path": "./MEDTRIX/prepx_Biochemistry.html"
  },
  {
    "title": "Vitamins-Previous_Year_Questions",
    "file": "Vitamins-Previous_Year_Questions.json",
    "questions": 59,
    "path": "./MEDTRIX/prepx_Biochemistry.html"
  },
  {
    "title": "Vitamins-Water-Soluble_Vitamins__Roles__Deficiencies__and_Alcohol_Impact",
    "file": "Vitamins-Water-Soluble_Vitamins__Roles__Deficiencies__and_Alcohol_Impact.json",
    "questions": 21,
    "path": "./MEDTRIX/prepx_Biochemistry.html"
  },
  {
    "title": "Carbohydrate_Metabolism",
    "file": "Carbohydrate_Metabolism.json",
    "questions": 21,
    "path": "./MEDTRIX/Prep_RR_Qb_Biochemistry.html"
  },
  {
    "title": "Cell_Sub_Organelles_Test_Types_of_Blood_Collection_Tubes",
    "file": "Cell_Sub_Organelles_Test_Types_of_Blood_Collection_Tubes.json",
    "questions": 9,
    "path": "./MEDTRIX/Prep_RR_Qb_Biochemistry.html"
  },
  {
    "title": "Genetics",
    "file": "Genetics.json",
    "questions": 21,
    "path": "./MEDTRIX/Prep_RR_Qb_Biochemistry.html"
  },
  {
    "title": "Heme_Synthesis_and_Porphyrias_Lipids",
    "file": "Heme_Synthesis_and_Porphyrias_Lipids.json",
    "questions": 22,
    "path": "./MEDTRIX/Prep_RR_Qb_Biochemistry.html"
  },
  {
    "title": "Introduction_to_Metabolism",
    "file": "Introduction_to_Metabolism.json",
    "questions": 2,
    "path": "./MEDTRIX/Prep_RR_Qb_Biochemistry.html"
  },
  {
    "title": "Vitamins_and_Amino_Acid_Metabolism",
    "file": "Vitamins_and_Amino_Acid_Metabolism.json",
    "questions": 19,
    "path": "./MEDTRIX/Prep_RR_Qb_Biochemistry.html"
  },
  {
    "title": "Microbiology E&D (Mission NEET PG) - 20-10-2023 - 2023-10-20",
    "file": "Microbiology_ED_Mission_NEET_PG_-_20-10-2023_-_2023-10-20.json",
    "questions": 50,
    "path": "./MEDTRIX/CEREB Microbiology.html"
  },
  {
    "title": "Microbiology E&D (Mission NEET PG_INICET 2.0) - 01-06-2024 - 2024-06-01",
    "file": "Microbiology_ED_Mission_NEET_PG_INICET_20_-_01-06-2024_-_2024-06-01.json",
    "questions": 100,
    "path": "./MEDTRIX/CEREB Microbiology.html"
  },
  {
    "title": "Microbiology E&D - Mission 1.5 - 28-03-2024 - 2024-03-28",
    "file": "Microbiology_ED_-_Mission_15_-_28-03-2024_-_2024-03-28.json",
    "questions": 100,
    "path": "./MEDTRIX/CEREB Microbiology.html"
  },
  {
    "title": "Microbiology E&D - Mission 1.5, Lap 2 - 24-05-2024 - 2024-05-24",
    "file": "Microbiology_ED_-_Mission_15_Lap_2_-_24-05-2024_-_2024-05-24.json",
    "questions": 75,
    "path": "./MEDTRIX/CEREB Microbiology.html"
  },
  {
    "title": "Microbiology E&D - Mission 2.0 (Batch 2) - 17-12-2024 - 2024-12-17",
    "file": "Microbiology_ED_-_Mission_20_Batch_2_-_17-12-2024_-_2024-12-17.json",
    "questions": 70,
    "path": "./MEDTRIX/CEREB Microbiology.html"
  },
  {
    "title": "Microbiology E&D - Mission 2.0 (Batch 3) - 11-01-2025 - 2025-01-11",
    "file": "Microbiology_ED_-_Mission_20_Batch_3_-_11-01-2025_-_2025-01-11.json",
    "questions": 75,
    "path": "./MEDTRIX/CEREB Microbiology.html"
  },
  {
    "title": "Microbiology E&D - Mission 2.0 (INICET) - 30-09-2024 - 2024-09-30",
    "file": "Microbiology_ED_-_Mission_20_INICET_-_30-09-2024_-_2024-09-30.json",
    "questions": 75,
    "path": "./MEDTRIX/CEREB Microbiology.html"
  },
  {
    "title": "Microbiology E&D - Mission 2.0, Lap 2 - 05-05-2025 - 2025-05-05",
    "file": "Microbiology_ED_-_Mission_20_Lap_2_-_05-05-2025_-_2025-05-05.json",
    "questions": 75,
    "path": "./MEDTRIX/CEREB Microbiology.html"
  },
  {
    "title": "Microbiology E&D - Mission NEET PG 2.0 - Final Batch - 15-06-2025 - 2025-06-15",
    "file": "Microbiology_ED_-_Mission_NEET_PG_20_-_Final_Batch_-_15-06-2025_-_2025-06-15.json",
    "questions": 75,
    "path": "./MEDTRIX/CEREB Microbiology.html"
  },
  {
    "title": "Microbiology E&D Test-1 - 08-05-2023 - 2023-05-08",
    "file": "Microbiology_ED_Test-1_-_08-05-2023_-_2023-05-08.json",
    "questions": 50,
    "path": "./MEDTRIX/CEREB Microbiology.html"
  },
  {
    "title": "Microbiology E&D Test-2 - 13-05-2023 - 2023-05-13",
    "file": "Microbiology_ED_Test-2_-_13-05-2023_-_2023-05-13.json",
    "questions": 50,
    "path": "./MEDTRIX/CEREB Microbiology.html"
  },
  {
    "title": "Microbiology Last Month E&D - 30-07-2024 - 2024-07-30",
    "file": "Microbiology_Last_Month_ED_-_30-07-2024_-_2024-07-30.json",
    "questions": 30,
    "path": "./MEDTRIX/CEREB Microbiology.html"
  },
  {
    "title": "Microbiology NEET PG Revision E&D - 30-12-2023 - 2023-12-30",
    "file": "Microbiology_NEET_PG_Revision_ED_-_30-12-2023_-_2023-12-30.json",
    "questions": 50,
    "path": "./MEDTRIX/CEREB Microbiology.html"
  },
  {
    "title": "Microbiology Test (The Champion Batch Hyderabad) - 02-01-2025 - 2025-01-02",
    "file": "Microbiology_Test_The_Champion_Batch_Hyderabad_-_02-01-2025_-_2025-01-02.json",
    "questions": 75,
    "path": "./MEDTRIX/CEREB Microbiology.html"
  },
  {
    "title": "Microbiology Test (The Champion Batch Hyderabad) - 12-07-2024 - 2024-07-12",
    "file": "Microbiology_Test_The_Champion_Batch_Hyderabad_-_12-07-2024_-_2024-07-12.json",
    "questions": 75,
    "path": "./MEDTRIX/CEREB Microbiology.html"
  },
  {
    "title": "T-20 Microbiology Test-1 - 25-05-2023 - 2023-05-25",
    "file": "T-20_Microbiology_Test-1_-_25-05-2023_-_2023-05-25.json",
    "questions": 20,
    "path": "./MEDTRIX/CEREB Microbiology.html"
  },
  {
    "title": "T-20 Microbiology Test-2 - 01-06-2023 - 2023-06-01",
    "file": "T-20_Microbiology_Test-2_-_01-06-2023_-_2023-06-01.json",
    "questions": 20,
    "path": "./MEDTRIX/CEREB Microbiology.html"
  },
  {
    "title": "T-20 Microbiology Test-3 - 21-06-2023 - 2023-06-21",
    "file": "T-20_Microbiology_Test-3_-_21-06-2023_-_2023-06-21.json",
    "questions": 20,
    "path": "./MEDTRIX/CEREB Microbiology.html"
  },
  {
    "title": "T-20 Microbiology Test-4 - 12-07-2023 - 2023-07-12",
    "file": "T-20_Microbiology_Test-4_-_12-07-2023_-_2023-07-12.json",
    "questions": 20,
    "path": "./MEDTRIX/CEREB Microbiology.html"
  },
  {
    "title": "T-20 Microbiology Test-5 - 26-07-2023 - 2023-07-26",
    "file": "T-20_Microbiology_Test-5_-_26-07-2023_-_2023-07-26.json",
    "questions": 20,
    "path": "./MEDTRIX/CEREB Microbiology.html"
  },
  {
    "title": "T-20 Microbiology Test-6 - 10-08-2023 - 2023-08-10",
    "file": "T-20_Microbiology_Test-6_-_10-08-2023_-_2023-08-10.json",
    "questions": 20,
    "path": "./MEDTRIX/CEREB Microbiology.html"
  },
  {
    "title": "T-20 Microbiology Test-7 - 18-08-2023 - 2023-08-18",
    "file": "T-20_Microbiology_Test-7_-_18-08-2023_-_2023-08-18.json",
    "questions": 20,
    "path": "./MEDTRIX/CEREB Microbiology.html"
  },
  {
    "title": "T-20 Microbiology Test-8 - 08-09-2023 - 2023-09-08",
    "file": "T-20_Microbiology_Test-8_-_08-09-2023_-_2023-09-08.json",
    "questions": 20,
    "path": "./MEDTRIX/CEREB Microbiology.html"
  },
  {
    "title": "T-20 Microbiology Test-9 - 29-09-2023 - 2023-09-29",
    "file": "T-20_Microbiology_Test-9_-_29-09-2023_-_2023-09-29.json",
    "questions": 20,
    "path": "./MEDTRIX/CEREB Microbiology.html"
  },
  {
    "title": "PSYCHIATRY-(INICET NOV 2024)",
    "file": "PSYCHIATRY-INICET_NOV_2024.json",
    "questions": 1,
    "path": "./MEDTRIX/psyc_pyq.html"
  },
  {
    "title": "Psychiatry - AIIMS JUNE 2020",
    "file": "Psychiatry_-_AIIMS_JUNE_2020.json",
    "questions": 2,
    "path": "./MEDTRIX/psyc_pyq.html"
  },
  {
    "title": "Psychiatry - AIIMS MAY 2018",
    "file": "Psychiatry_-_AIIMS_MAY_2018.json",
    "questions": 5,
    "path": "./MEDTRIX/psyc_pyq.html"
  },
  {
    "title": "Psychiatry - AIIMS MAY 2019",
    "file": "Psychiatry_-_AIIMS_MAY_2019.json",
    "questions": 6,
    "path": "./MEDTRIX/psyc_pyq.html"
  },
  {
    "title": "Psychiatry - AIIMS NOV 2018",
    "file": "Psychiatry_-_AIIMS_NOV_2018.json",
    "questions": 7,
    "path": "./MEDTRIX/psyc_pyq.html"
  },
  {
    "title": "Psychiatry - AIIMS NOV 2019",
    "file": "Psychiatry_-_AIIMS_NOV_2019.json",
    "questions": 4,
    "path": "./MEDTRIX/psyc_pyq.html"
  },
  {
    "title": "Psychiatry - INI CET 2020",
    "file": "Psychiatry_-_INI_CET_2020.json",
    "questions": 8,
    "path": "./MEDTRIX/psyc_pyq.html"
  },
  {
    "title": "Psychiatry - INI CET JULY 2021",
    "file": "Psychiatry_-_INI_CET_JULY_2021.json",
    "questions": 4,
    "path": "./MEDTRIX/psyc_pyq.html"
  },
  {
    "title": "Psychiatry - INI CET MAY 2022",
    "file": "Psychiatry_-_INI_CET_MAY_2022.json",
    "questions": 3,
    "path": "./MEDTRIX/psyc_pyq.html"
  },
  {
    "title": "Psychiatry - INI CET MAY 2023",
    "file": "Psychiatry_-_INI_CET_MAY_2023.json",
    "questions": 3,
    "path": "./MEDTRIX/psyc_pyq.html"
  },
  {
    "title": "Psychiatry - INI CET NOV 2021",
    "file": "Psychiatry_-_INI_CET_NOV_2021.json",
    "questions": 2,
    "path": "./MEDTRIX/psyc_pyq.html"
  },
  {
    "title": "Psychiatry - INI CET NOV 2023",
    "file": "Psychiatry_-_INI_CET_NOV_2023.json",
    "questions": 3,
    "path": "./MEDTRIX/psyc_pyq.html"
  },
  {
    "title": "Psychiatry - INI CET NOVEMBER 2022 (PART - A)",
    "file": "Psychiatry_-_INI_CET_NOVEMBER_2022_PART_-_A.json",
    "questions": 7,
    "path": "./MEDTRIX/psyc_pyq.html"
  },
  {
    "title": "Psychiatry - INI CET NOVEMBER 2022 (PART - B)",
    "file": "Psychiatry_-_INI_CET_NOVEMBER_2022_PART_-_B.json",
    "questions": 3,
    "path": "./MEDTRIX/psyc_pyq.html"
  },
  {
    "title": "Psychiatry - INICET MAY 2024",
    "file": "Psychiatry_-_INICET_MAY_2024.json",
    "questions": 6,
    "path": "./MEDTRIX/psyc_pyq.html"
  },
  {
    "title": "Psychiatry - NEET PG 2018",
    "file": "Psychiatry_-_NEET_PG_2018.json",
    "questions": 12,
    "path": "./MEDTRIX/psyc_pyq.html"
  },
  {
    "title": "Psychiatry - NEET PG 2019",
    "file": "Psychiatry_-_NEET_PG_2019.json",
    "questions": 9,
    "path": "./MEDTRIX/psyc_pyq.html"
  },
  {
    "title": "Psychiatry - NEET PG 2020",
    "file": "Psychiatry_-_NEET_PG_2020.json",
    "questions": 4,
    "path": "./MEDTRIX/psyc_pyq.html"
  },
  {
    "title": "Psychiatry - NEET PG 2021",
    "file": "Psychiatry_-_NEET_PG_2021.json",
    "questions": 5,
    "path": "./MEDTRIX/psyc_pyq.html"
  },
  {
    "title": "Psychiatry - NEET PG 2022",
    "file": "Psychiatry_-_NEET_PG_2022.json",
    "questions": 2,
    "path": "./MEDTRIX/psyc_pyq.html"
  },
  {
    "title": "Psychiatry - NEET PG 2023",
    "file": "Psychiatry_-_NEET_PG_2023.json",
    "questions": 4,
    "path": "./MEDTRIX/psyc_pyq.html"
  },
  {
    "title": "Psychiatry - NEET PG 2024",
    "file": "Psychiatry_-_NEET_PG_2024.json",
    "questions": 10,
    "path": "./MEDTRIX/psyc_pyq.html"
  },
  {
    "title": "CNS_Physiology",
    "file": "CNS_Physiology.json",
    "questions": 24,
    "path": "./MEDTRIX/Prep_RR_Qb_Physiology.html"
  },
  {
    "title": "Cardiovascular_System_",
    "file": "Cardiovascular_System_.json",
    "questions": 20,
    "path": "./MEDTRIX/Prep_RR_Qb_Physiology.html"
  },
  {
    "title": "Endocrine_and_Reproductive_Physiology",
    "file": "Endocrine_and_Reproductive_Physiology.json",
    "questions": 5,
    "path": "./MEDTRIX/Prep_RR_Qb_Physiology.html"
  },
  {
    "title": "GIT_Physiology",
    "file": "GIT_Physiology.json",
    "questions": 2,
    "path": "./MEDTRIX/Prep_RR_Qb_Physiology.html"
  },
  {
    "title": "General_Physiology_",
    "file": "General_Physiology_.json",
    "questions": 10,
    "path": "./MEDTRIX/Prep_RR_Qb_Physiology.html"
  },
  {
    "title": "Nerve_muscle_physiology_",
    "file": "Nerve_muscle_physiology_.json",
    "questions": 10,
    "path": "./MEDTRIX/Prep_RR_Qb_Physiology.html"
  },
  {
    "title": "Renal_Physiology",
    "file": "Renal_Physiology.json",
    "questions": 24,
    "path": "./MEDTRIX/Prep_RR_Qb_Physiology.html"
  },
  {
    "title": "Respiratory_System_",
    "file": "Respiratory_System_.json",
    "questions": 35,
    "path": "./MEDTRIX/Prep_RR_Qb_Physiology.html"
  },
  {
    "title": "CT",
    "file": "CT.json",
    "questions": 13,
    "path": "./MEDTRIX/CEREB_Radiology.html"
  },
  {
    "title": "CVS Radiology",
    "file": "CVS_Radiology.json",
    "questions": 19,
    "path": "./MEDTRIX/CEREB_Radiology.html"
  },
  {
    "title": "Contrast Media",
    "file": "Contrast_Media.json",
    "questions": 13,
    "path": "./MEDTRIX/CEREB_Radiology.html"
  },
  {
    "title": "Gastrointestinal Radiology",
    "file": "Gastrointestinal_Radiology.json",
    "questions": 31,
    "path": "./MEDTRIX/CEREB_Radiology.html"
  },
  {
    "title": "Genito-Urinary Radiology",
    "file": "Genito-Urinary_Radiology.json",
    "questions": 24,
    "path": "./MEDTRIX/CEREB_Radiology.html"
  },
  {
    "title": "Hepatobiliary-Pancreatic Radiology",
    "file": "Hepatobiliary-Pancreatic_Radiology.json",
    "questions": 13,
    "path": "./MEDTRIX/CEREB_Radiology.html"
  },
  {
    "title": "Introduction",
    "file": "Introduction.json",
    "questions": 18,
    "path": "./MEDTRIX/CEREB_Radiology.html"
  },
  {
    "title": "MRI",
    "file": "MRI.json",
    "questions": 17,
    "path": "./MEDTRIX/CEREB_Radiology.html"
  },
  {
    "title": "MSK Imaging",
    "file": "MSK_Imaging.json",
    "questions": 29,
    "path": "./MEDTRIX/CEREB_Radiology.html"
  },
  {
    "title": "Named X-Ray Views",
    "file": "Named_X-Ray_Views.json",
    "questions": 5,
    "path": "./MEDTRIX/CEREB_Radiology.html"
  },
  {
    "title": "Neuroradiology",
    "file": "Neuroradiology.json",
    "questions": 27,
    "path": "./MEDTRIX/CEREB_Radiology.html"
  },
  {
    "title": "Nuclear Medicine",
    "file": "Nuclear_Medicine.json",
    "questions": 24,
    "path": "./MEDTRIX/CEREB_Radiology.html"
  },
  {
    "title": "Radiological Anatomy",
    "file": "Radiological_Anatomy.json",
    "questions": 7,
    "path": "./MEDTRIX/CEREB_Radiology.html"
  },
  {
    "title": "Radiotherapy",
    "file": "Radiotherapy.json",
    "questions": 25,
    "path": "./MEDTRIX/CEREB_Radiology.html"
  },
  {
    "title": "Respiratory Radiology",
    "file": "Respiratory_Radiology.json",
    "questions": 32,
    "path": "./MEDTRIX/CEREB_Radiology.html"
  },
  {
    "title": "USG",
    "file": "USG.json",
    "questions": 12,
    "path": "./MEDTRIX/CEREB_Radiology.html"
  },
  {
    "title": "Women's Imaging",
    "file": "Womens_Imaging.json",
    "questions": 20,
    "path": "./MEDTRIX/CEREB_Radiology.html"
  },
  {
    "title": "X-RAY",
    "file": "X-RAY.json",
    "questions": 9,
    "path": "./MEDTRIX/CEREB_Radiology.html"
  },
  {
    "title": "Anatomy_FMGE_PYQ",
    "file": "Anatomy_FMGE_PYQ.json",
    "questions": 115,
    "path": "./MEDTRIX/DQB FMGE_PYQ.html"
  },
  {
    "title": "Anesthesia_FMGE_PYQ",
    "file": "Anesthesia_FMGE_PYQ.json",
    "questions": 26,
    "path": "./MEDTRIX/DQB FMGE_PYQ.html"
  },
  {
    "title": "Biochemistry_FMGE_PYQ",
    "file": "Biochemistry_FMGE_PYQ.json",
    "questions": 122,
    "path": "./MEDTRIX/DQB FMGE_PYQ.html"
  },
  {
    "title": "Dermatology_FMGE_PYQ",
    "file": "Dermatology_FMGE_PYQ.json",
    "questions": 97,
    "path": "./MEDTRIX/DQB FMGE_PYQ.html"
  },
  {
    "title": "ENT_FMGE_PYQ",
    "file": "ENT_FMGE_PYQ.json",
    "questions": 83,
    "path": "./MEDTRIX/DQB FMGE_PYQ.html"
  },
  {
    "title": "FMT_FMGE_PYQ",
    "file": "FMT_FMGE_PYQ.json",
    "questions": 83,
    "path": "./MEDTRIX/DQB FMGE_PYQ.html"
  },
  {
    "title": "Gynaecology_FMGE_PYQ",
    "file": "Gynaecology_FMGE_PYQ.json",
    "questions": 82,
    "path": "./MEDTRIX/DQB FMGE_PYQ.html"
  },
  {
    "title": "Medicine_FMGE_PYQ",
    "file": "Medicine_FMGE_PYQ.json",
    "questions": 124,
    "path": "./MEDTRIX/DQB FMGE_PYQ.html"
  },
  {
    "title": "Microbiology_FMGE_PYQ",
    "file": "Microbiology_FMGE_PYQ.json",
    "questions": 106,
    "path": "./MEDTRIX/DQB FMGE_PYQ.html"
  },
  {
    "title": "Obstetrics_FMGE_PYQ",
    "file": "Obstetrics_FMGE_PYQ.json",
    "questions": 97,
    "path": "./MEDTRIX/DQB FMGE_PYQ.html"
  },
  {
    "title": "Ophthalmology-FMGE_PYQ",
    "file": "Ophthalmology-FMGE_PYQ.json",
    "questions": 137,
    "path": "./MEDTRIX/DQB FMGE_PYQ.html"
  },
  {
    "title": "Orthopedics_FMGE_PYQ",
    "file": "Orthopedics_FMGE_PYQ.json",
    "questions": 41,
    "path": "./MEDTRIX/DQB FMGE_PYQ.html"
  },
  {
    "title": "PSM_FMGE_PYQ",
    "file": "PSM_FMGE_PYQ.json",
    "questions": 167,
    "path": "./MEDTRIX/DQB FMGE_PYQ.html"
  },
  {
    "title": "Pathology_FMGE_PYQ",
    "file": "Pathology_FMGE_PYQ.json",
    "questions": 113,
    "path": "./MEDTRIX/DQB FMGE_PYQ.html"
  },
  {
    "title": "Pediatrics_FMGE_PYQ",
    "file": "Pediatrics_FMGE_PYQ.json",
    "questions": 69,
    "path": "./MEDTRIX/DQB FMGE_PYQ.html"
  },
  {
    "title": "Pharmacology_FMGE_PYQ",
    "file": "Pharmacology_FMGE_PYQ.json",
    "questions": 152,
    "path": "./MEDTRIX/DQB FMGE_PYQ.html"
  },
  {
    "title": "Physiology_FMGE_PYQ",
    "file": "Physiology_FMGE_PYQ.json",
    "questions": 73,
    "path": "./MEDTRIX/DQB FMGE_PYQ.html"
  },
  {
    "title": "Psychiatry_FMGE_PYQ",
    "file": "Psychiatry_FMGE_PYQ.json",
    "questions": 65,
    "path": "./MEDTRIX/DQB FMGE_PYQ.html"
  },
  {
    "title": "Radiology_FMGE_PYQ",
    "file": "Radiology_FMGE_PYQ.json",
    "questions": 84,
    "path": "./MEDTRIX/DQB FMGE_PYQ.html"
  },
  {
    "title": "Surgery_FMGE_PYQ",
    "file": "Surgery_FMGE_PYQ.json",
    "questions": 187,
    "path": "./MEDTRIX/DQB FMGE_PYQ.html"
  },
  {
    "title": "Amenorrhoea",
    "file": "Amenorrhoea.json",
    "questions": 37,
    "path": "./MEDTRIX/DQB Gynaecology.html"
  },
  {
    "title": "Applied_anatomy_and_heading",
    "file": "Applied_anatomy_and_heading.json",
    "questions": 56,
    "path": "./MEDTRIX/DQB Gynaecology.html"
  },
  {
    "title": "Cervical_Cancer",
    "file": "Cervical_Cancer.json",
    "questions": 40,
    "path": "./MEDTRIX/DQB Gynaecology.html"
  },
  {
    "title": "Endometrial_Cancer",
    "file": "Endometrial_Cancer.json",
    "questions": 24,
    "path": "./MEDTRIX/DQB Gynaecology.html"
  },
  {
    "title": "Endometriosis",
    "file": "Endometriosis.json",
    "questions": 10,
    "path": "./MEDTRIX/DQB Gynaecology.html"
  },
  {
    "title": "Female_Infertility",
    "file": "Female_Infertility.json",
    "questions": 71,
    "path": "./MEDTRIX/DQB Gynaecology.html"
  },
  {
    "title": "Fibroid",
    "file": "Fibroid.json",
    "questions": 26,
    "path": "./MEDTRIX/DQB Gynaecology.html"
  },
  {
    "title": "Gynaecology_Image_based_questions",
    "file": "Gynaecology_Image_based_questions.json",
    "questions": 70,
    "path": "./MEDTRIX/DQB Gynaecology.html"
  },
  {
    "title": "Infections",
    "file": "Infections.json",
    "questions": 20,
    "path": "./MEDTRIX/DQB Gynaecology.html"
  },
  {
    "title": "Menopause",
    "file": "Menopause.json",
    "questions": 12,
    "path": "./MEDTRIX/DQB Gynaecology.html"
  },
  {
    "title": "Menstrual_cycle_physiology",
    "file": "Menstrual_cycle_physiology.json",
    "questions": 47,
    "path": "./MEDTRIX/DQB Gynaecology.html"
  },
  {
    "title": "Ovarian_Cancer",
    "file": "Ovarian_Cancer.json",
    "questions": 43,
    "path": "./MEDTRIX/DQB Gynaecology.html"
  },
  {
    "title": "Pcos",
    "file": "Pcos.json",
    "questions": 27,
    "path": "./MEDTRIX/DQB Gynaecology.html"
  },
  {
    "title": "Permanent_Methods_of_Contraception",
    "file": "Permanent_Methods_of_Contraception.json",
    "questions": 14,
    "path": "./MEDTRIX/DQB Gynaecology.html"
  },
  {
    "title": "Prolapse",
    "file": "Prolapse.json",
    "questions": 32,
    "path": "./MEDTRIX/DQB Gynaecology.html"
  },
  {
    "title": "Puberty",
    "file": "Puberty.json",
    "questions": 10,
    "path": "./MEDTRIX/DQB Gynaecology.html"
  },
  {
    "title": "Reversible_Methods_of_Contraception",
    "file": "Reversible_Methods_of_Contraception.json",
    "questions": 51,
    "path": "./MEDTRIX/DQB Gynaecology.html"
  },
  {
    "title": "Arthritis",
    "file": "Arthritis.json",
    "questions": 98,
    "path": "./MEDTRIX/CEREB_Orthopedics.html"
  },
  {
    "title": "Bone & Imaging",
    "file": "Bone__Imaging.json",
    "questions": 8,
    "path": "./MEDTRIX/CEREB_Orthopedics.html"
  },
  {
    "title": "Bone & Joint Infections",
    "file": "Bone__Joint_Infections.json",
    "questions": 19,
    "path": "./MEDTRIX/CEREB_Orthopedics.html"
  },
  {
    "title": "General + Upper Limb Traumatology",
    "file": "General__Upper_Limb_Traumatology.json",
    "questions": 156,
    "path": "./MEDTRIX/CEREB_Orthopedics.html"
  },
  {
    "title": "Metabolic Disorders",
    "file": "Metabolic_Disorders.json",
    "questions": 68,
    "path": "./MEDTRIX/CEREB_Orthopedics.html"
  },
  {
    "title": "Nerve Injuries",
    "file": "Nerve_Injuries.json",
    "questions": 125,
    "path": "./MEDTRIX/CEREB_Orthopedics.html"
  },
  {
    "title": "Orthopedics Oncology",
    "file": "Orthopedics_Oncology.json",
    "questions": 37,
    "path": "./MEDTRIX/CEREB_Orthopedics.html"
  },
  {
    "title": "Pediatric Orthopedics",
    "file": "Pediatric_Orthopedics.json",
    "questions": 69,
    "path": "./MEDTRIX/CEREB_Orthopedics.html"
  },
  {
    "title": "Spine + Pelvis + Lower Limb Traumatology",
    "file": "Spine__Pelvis__Lower_Limb_Traumatology.json",
    "questions": 185,
    "path": "./MEDTRIX/CEREB_Orthopedics.html"
  },
  {
    "title": "Sports Injury & NM Disorders",
    "file": "Sports_Injury__NM_Disorders.json",
    "questions": 170,
    "path": "./MEDTRIX/CEREB_Orthopedics.html"
  },
  {
    "title": "Tuberculosis of Bone & Joints",
    "file": "Tuberculosis_of_Bone__Joints.json",
    "questions": 19,
    "path": "./MEDTRIX/CEREB_Orthopedics.html"
  },
  {
    "title": "MICROBIOLOGY-(INICET NOV 2024)",
    "file": "MICROBIOLOGY-INICET_NOV_2024.json",
    "questions": 15,
    "path": "./MEDTRIX/micro_pyq.html"
  },
  {
    "title": "Microbiology - AIIMS JUNE 2020",
    "file": "Microbiology_-_AIIMS_JUNE_2020.json",
    "questions": 21,
    "path": "./MEDTRIX/micro_pyq.html"
  },
  {
    "title": "Microbiology - AIIMS MAY 2018",
    "file": "Microbiology_-_AIIMS_MAY_2018.json",
    "questions": 15,
    "path": "./MEDTRIX/micro_pyq.html"
  },
  {
    "title": "Microbiology - AIIMS MAY 2019",
    "file": "Microbiology_-_AIIMS_MAY_2019.json",
    "questions": 14,
    "path": "./MEDTRIX/micro_pyq.html"
  },
  {
    "title": "Microbiology - AIIMS NOV 2018",
    "file": "Microbiology_-_AIIMS_NOV_2018.json",
    "questions": 9,
    "path": "./MEDTRIX/micro_pyq.html"
  },
  {
    "title": "Microbiology - AIIMS NOV 2019",
    "file": "Microbiology_-_AIIMS_NOV_2019.json",
    "questions": 12,
    "path": "./MEDTRIX/micro_pyq.html"
  },
  {
    "title": "Microbiology - INI CET JULY 2021",
    "file": "Microbiology_-_INI_CET_JULY_2021.json",
    "questions": 14,
    "path": "./MEDTRIX/micro_pyq.html"
  },
  {
    "title": "Microbiology - INI CET MAY 2022",
    "file": "Microbiology_-_INI_CET_MAY_2022.json",
    "questions": 9,
    "path": "./MEDTRIX/micro_pyq.html"
  },
  {
    "title": "Microbiology - INI CET MAY 2023",
    "file": "Microbiology_-_INI_CET_MAY_2023.json",
    "questions": 8,
    "path": "./MEDTRIX/micro_pyq.html"
  },
  {
    "title": "Microbiology - INI CET NOV 2020",
    "file": "Microbiology_-_INI_CET_NOV_2020.json",
    "questions": 12,
    "path": "./MEDTRIX/micro_pyq.html"
  },
  {
    "title": "Microbiology - INI CET NOV 2021",
    "file": "Microbiology_-_INI_CET_NOV_2021.json",
    "questions": 11,
    "path": "./MEDTRIX/micro_pyq.html"
  },
  {
    "title": "Microbiology - INI CET NOV 2022 (PART A)",
    "file": "Microbiology_-_INI_CET_NOV_2022_PART_A.json",
    "questions": 12,
    "path": "./MEDTRIX/micro_pyq.html"
  },
  {
    "title": "Microbiology - INI CET NOV 2022 (PART B)",
    "file": "Microbiology_-_INI_CET_NOV_2022_PART_B.json",
    "questions": 11,
    "path": "./MEDTRIX/micro_pyq.html"
  },
  {
    "title": "Microbiology - INI CET NOV 2023",
    "file": "Microbiology_-_INI_CET_NOV_2023.json",
    "questions": 18,
    "path": "./MEDTRIX/micro_pyq.html"
  },
  {
    "title": "Microbiology - INICET MAY 2024",
    "file": "Microbiology_-_INICET_MAY_2024.json",
    "questions": 13,
    "path": "./MEDTRIX/micro_pyq.html"
  },
  {
    "title": "Microbiology - NEET PG 2018",
    "file": "Microbiology_-_NEET_PG_2018.json",
    "questions": 11,
    "path": "./MEDTRIX/micro_pyq.html"
  },
  {
    "title": "Microbiology - NEET PG 2019",
    "file": "Microbiology_-_NEET_PG_2019.json",
    "questions": 25,
    "path": "./MEDTRIX/micro_pyq.html"
  },
  {
    "title": "Microbiology - NEET PG 2020",
    "file": "Microbiology_-_NEET_PG_2020.json",
    "questions": 19,
    "path": "./MEDTRIX/micro_pyq.html"
  },
  {
    "title": "Microbiology - NEET PG 2021",
    "file": "Microbiology_-_NEET_PG_2021.json",
    "questions": 14,
    "path": "./MEDTRIX/micro_pyq.html"
  },
  {
    "title": "Microbiology - NEET PG 2022",
    "file": "Microbiology_-_NEET_PG_2022.json",
    "questions": 17,
    "path": "./MEDTRIX/micro_pyq.html"
  },
  {
    "title": "Microbiology - NEET PG 2023",
    "file": "Microbiology_-_NEET_PG_2023.json",
    "questions": 4,
    "path": "./MEDTRIX/micro_pyq.html"
  },
  {
    "title": "Microbiology - NEET PG 2024",
    "file": "Microbiology_-_NEET_PG_2024.json",
    "questions": 25,
    "path": "./MEDTRIX/micro_pyq.html"
  },
  {
    "title": "Abdomen & Pelvis",
    "file": "Abdomen__Pelvis.json",
    "questions": 147,
    "path": "./MEDTRIX/CEREB_Anatomy.html"
  },
  {
    "title": "Basic Concept, Tricks and Magic of Anatomy",
    "file": "Basic_Concept_Tricks_and_Magic_of_Anatomy.json",
    "questions": 2,
    "path": "./MEDTRIX/CEREB_Anatomy.html"
  },
  {
    "title": "Brain",
    "file": "Brain.json",
    "questions": 65,
    "path": "./MEDTRIX/CEREB_Anatomy.html"
  },
  {
    "title": "Embryology",
    "file": "Embryology.json",
    "questions": 72,
    "path": "./MEDTRIX/CEREB_Anatomy.html"
  },
  {
    "title": "General Anatomy",
    "file": "General_Anatomy.json",
    "questions": 26,
    "path": "./MEDTRIX/CEREB_Anatomy.html"
  },
  {
    "title": "Head, Neck and Face",
    "file": "Head_Neck_and_Face.json",
    "questions": 230,
    "path": "./MEDTRIX/CEREB_Anatomy.html"
  },
  {
    "title": "Histology",
    "file": "Histology.json",
    "questions": 75,
    "path": "./MEDTRIX/CEREB_Anatomy.html"
  },
  {
    "title": "Lower Limb",
    "file": "Lower_Limb.json",
    "questions": 72,
    "path": "./MEDTRIX/CEREB_Anatomy.html"
  },
  {
    "title": "Thorax",
    "file": "Thorax.json",
    "questions": 50,
    "path": "./MEDTRIX/CEREB_Anatomy.html"
  },
  {
    "title": "Upper Limb",
    "file": "Upper_Limb.json",
    "questions": 43,
    "path": "./MEDTRIX/CEREB_Anatomy.html"
  },
  {
    "title": "07_Anatomy_Dr_Sandeep",
    "file": "07_Anatomy_Dr_Sandeep.json",
    "questions": 40,
    "path": "./MEDTRIX/DAMS_CT_FMGE.html"
  },
  {
    "title": "17_Anatomy_FMGE_Dr_Sandeep",
    "file": "17_Anatomy_FMGE_Dr_Sandeep.json",
    "questions": 40,
    "path": "./MEDTRIX/DAMS_CT_FMGE.html"
  },
  {
    "title": "215_Microbiology",
    "file": "215_Microbiology.json",
    "questions": 40,
    "path": "./MEDTRIX/DAMS_CT_FMGE.html"
  },
  {
    "title": "21_Anesthesia_Dr_Anshul",
    "file": "21_Anesthesia_Dr_Anshul.json",
    "questions": 40,
    "path": "./MEDTRIX/DAMS_CT_FMGE.html"
  },
  {
    "title": "253_Ophthalmology_Dr_Manish",
    "file": "253_Ophthalmology_Dr_Manish.json",
    "questions": 40,
    "path": "./MEDTRIX/DAMS_CT_FMGE.html"
  },
  {
    "title": "272_Pathology_Dr_Shagun",
    "file": "272_Pathology_Dr_Shagun.json",
    "questions": 40,
    "path": "./MEDTRIX/DAMS_CT_FMGE.html"
  },
  {
    "title": "292_Pediatrics_Dr_Ashutosh",
    "file": "292_Pediatrics_Dr_Ashutosh.json",
    "questions": 40,
    "path": "./MEDTRIX/DAMS_CT_FMGE.html"
  },
  {
    "title": "303_Pharmacology_Dr_Dinesh",
    "file": "303_Pharmacology_Dr_Dinesh.json",
    "questions": 40,
    "path": "./MEDTRIX/DAMS_CT_FMGE.html"
  },
  {
    "title": "317_Physiology_Dr_Kamal",
    "file": "317_Physiology_Dr_Kamal.json",
    "questions": 40,
    "path": "./MEDTRIX/DAMS_CT_FMGE.html"
  },
  {
    "title": "32_Biochemistry_Dr_Sonam",
    "file": "32_Biochemistry_Dr_Sonam.json",
    "questions": 40,
    "path": "./MEDTRIX/DAMS_CT_FMGE.html"
  },
  {
    "title": "334_PSM_Dr_Kashish",
    "file": "334_PSM_Dr_Kashish.json",
    "questions": 40,
    "path": "./MEDTRIX/DAMS_CT_FMGE.html"
  },
  {
    "title": "335_PSM_Dr_Kashish",
    "file": "335_PSM_Dr_Kashish.json",
    "questions": 40,
    "path": "./MEDTRIX/DAMS_CT_FMGE.html"
  },
  {
    "title": "336_PSM_Dr_Kashish",
    "file": "336_PSM_Dr_Kashish.json",
    "questions": 50,
    "path": "./MEDTRIX/DAMS_CT_FMGE.html"
  },
  {
    "title": "348_Psychiatry_Dr_Sachin",
    "file": "348_Psychiatry_Dr_Sachin.json",
    "questions": 40,
    "path": "./MEDTRIX/DAMS_CT_FMGE.html"
  },
  {
    "title": "45_Dermatology_Dr_Chesta",
    "file": "45_Dermatology_Dr_Chesta.json",
    "questions": 40,
    "path": "./MEDTRIX/DAMS_CT_FMGE.html"
  },
  {
    "title": "55_ENT_Dr_Deepak",
    "file": "55_ENT_Dr_Deepak.json",
    "questions": 40,
    "path": "./MEDTRIX/DAMS_CT_FMGE.html"
  },
  {
    "title": "56_ENT_Dr_Deepak",
    "file": "56_ENT_Dr_Deepak.json",
    "questions": 40,
    "path": "./MEDTRIX/DAMS_CT_FMGE.html"
  },
  {
    "title": "59_ENT_Dr_Deepak",
    "file": "59_ENT_Dr_Deepak.json",
    "questions": 40,
    "path": "./MEDTRIX/DAMS_CT_FMGE.html"
  },
  {
    "title": "97_FMT_Dr_Mohit",
    "file": "97_FMT_Dr_Mohit.json",
    "questions": 40,
    "path": "./MEDTRIX/DAMS_CT_FMGE.html"
  },
  {
    "title": "Anatomy_DR_Sandeep_Class_Test_FMGE",
    "file": "Anatomy_DR_Sandeep_Class_Test_FMGE.json",
    "questions": 40,
    "path": "./MEDTRIX/DAMS_CT_FMGE.html"
  },
  {
    "title": "Anatomy_Dr_Sandeep",
    "file": "Anatomy_Dr_Sandeep.json",
    "questions": 25,
    "path": "./MEDTRIX/DAMS_CT_FMGE.html"
  },
  {
    "title": "Anatomy_FMGE_Dr_Sandeep",
    "file": "Anatomy_FMGE_Dr_Sandeep.json",
    "questions": 40,
    "path": "./MEDTRIX/DAMS_CT_FMGE.html"
  },
  {
    "title": "Anesthesia_Dr_Anshul",
    "file": "Anesthesia_Dr_Anshul.json",
    "questions": 40,
    "path": "./MEDTRIX/DAMS_CT_FMGE.html"
  },
  {
    "title": "Anesthesia_Dr_Anshul_FMGE_CT",
    "file": "Anesthesia_Dr_Anshul_FMGE_CT.json",
    "questions": 40,
    "path": "./MEDTRIX/DAMS_CT_FMGE.html"
  },
  {
    "title": "Biochemistry_Dr_Sonam",
    "file": "Biochemistry_Dr_Sonam.json",
    "questions": 40,
    "path": "./MEDTRIX/DAMS_CT_FMGE.html"
  },
  {
    "title": "Biochemistry_Dr_Sonam_FMGE_CT",
    "file": "Biochemistry_Dr_Sonam_FMGE_CT.json",
    "questions": 50,
    "path": "./MEDTRIX/DAMS_CT_FMGE.html"
  },
  {
    "title": "CT_Medicine_CNS_FMGE_CT",
    "file": "CT_Medicine_CNS_FMGE_CT.json",
    "questions": 40,
    "path": "./MEDTRIX/DAMS_CT_FMGE.html"
  },
  {
    "title": "CT_Surgery__Gen__uro_FMGE_CT",
    "file": "CT_Surgery__Gen__uro_FMGE_CT.json",
    "questions": 50,
    "path": "./MEDTRIX/DAMS_CT_FMGE.html"
  },
  {
    "title": "Dermatology_Dr_Chesta",
    "file": "Dermatology_Dr_Chesta.json",
    "questions": 50,
    "path": "./MEDTRIX/DAMS_CT_FMGE.html"
  },
  {
    "title": "Dermatology_Dr_Chesta_FMGE_CT",
    "file": "Dermatology_Dr_Chesta_FMGE_CT.json",
    "questions": 50,
    "path": "./MEDTRIX/DAMS_CT_FMGE.html"
  },
  {
    "title": "ENT_Dr_Deepak",
    "file": "ENT_Dr_Deepak.json",
    "questions": 75,
    "path": "./MEDTRIX/DAMS_CT_FMGE.html"
  },
  {
    "title": "FMGE_CT-_Anesthesia_Dr_Anshul",
    "file": "FMGE_CT-_Anesthesia_Dr_Anshul.json",
    "questions": 40,
    "path": "./MEDTRIX/DAMS_CT_FMGE.html"
  },
  {
    "title": "FMGE_CT-_Dermatology_Dr_Chesta",
    "file": "FMGE_CT-_Dermatology_Dr_Chesta.json",
    "questions": 40,
    "path": "./MEDTRIX/DAMS_CT_FMGE.html"
  },
  {
    "title": "FMGE_CT_-_Biochemistry",
    "file": "FMGE_CT_-_Biochemistry.json",
    "questions": 40,
    "path": "./MEDTRIX/DAMS_CT_FMGE.html"
  },
  {
    "title": "FMGE_CT_-_FMT",
    "file": "FMGE_CT_-_FMT.json",
    "questions": 40,
    "path": "./MEDTRIX/DAMS_CT_FMGE.html"
  },
  {
    "title": "FMGE_CT_-_Medicine_CNS",
    "file": "FMGE_CT_-_Medicine_CNS.json",
    "questions": 40,
    "path": "./MEDTRIX/DAMS_CT_FMGE.html"
  },
  {
    "title": "FMGE_CT_-_Medicine_Gastro__Endo",
    "file": "FMGE_CT_-_Medicine_Gastro__Endo.json",
    "questions": 40,
    "path": "./MEDTRIX/DAMS_CT_FMGE.html"
  },
  {
    "title": "FMGE_CT_-_Paediatrics",
    "file": "FMGE_CT_-_Paediatrics.json",
    "questions": 43,
    "path": "./MEDTRIX/DAMS_CT_FMGE.html"
  },
  {
    "title": "FMGE_CT_-_Psychiatry",
    "file": "FMGE_CT_-_Psychiatry.json",
    "questions": 40,
    "path": "./MEDTRIX/DAMS_CT_FMGE.html"
  },
  {
    "title": "FMGE_CT_-_Surgery_General__Urology",
    "file": "FMGE_CT_-_Surgery_General__Urology.json",
    "questions": 40,
    "path": "./MEDTRIX/DAMS_CT_FMGE.html"
  },
  {
    "title": "FMGE_CT_-__Surgery_HBP",
    "file": "FMGE_CT_-__Surgery_HBP.json",
    "questions": 40,
    "path": "./MEDTRIX/DAMS_CT_FMGE.html"
  },
  {
    "title": "FMGE_Dec_CT_-_Pathology_Gen_Hema",
    "file": "FMGE_Dec_CT_-_Pathology_Gen_Hema.json",
    "questions": 40,
    "path": "./MEDTRIX/DAMS_CT_FMGE.html"
  },
  {
    "title": "FMGE_Dec_CT_-_Pharmacology",
    "file": "FMGE_Dec_CT_-_Pharmacology.json",
    "questions": 50,
    "path": "./MEDTRIX/DAMS_CT_FMGE.html"
  },
  {
    "title": "FMGE_EndoGITRhumat_Dr_Rahul",
    "file": "FMGE_EndoGITRhumat_Dr_Rahul.json",
    "questions": 45,
    "path": "./MEDTRIX/DAMS_CT_FMGE.html"
  },
  {
    "title": "FMT_Dr_Mohit",
    "file": "FMT_Dr_Mohit.json",
    "questions": 40,
    "path": "./MEDTRIX/DAMS_CT_FMGE.html"
  },
  {
    "title": "FMT_Dr_Mohit_FMGE_CT",
    "file": "FMT_Dr_Mohit_FMGE_CT.json",
    "questions": 40,
    "path": "./MEDTRIX/DAMS_CT_FMGE.html"
  },
  {
    "title": "Gynaecology_Dr_Deepti__FMGE_CT",
    "file": "Gynaecology_Dr_Deepti__FMGE_CT.json",
    "questions": 50,
    "path": "./MEDTRIX/DAMS_CT_FMGE.html"
  },
  {
    "title": "Gynecology_Dr_Deepti",
    "file": "Gynecology_Dr_Deepti.json",
    "questions": 45,
    "path": "./MEDTRIX/DAMS_CT_FMGE.html"
  },
  {
    "title": "Medicine_CNS_Dr_Achin",
    "file": "Medicine_CNS_Dr_Achin.json",
    "questions": 50,
    "path": "./MEDTRIX/DAMS_CT_FMGE.html"
  },
  {
    "title": "Medicine_CVS_Dr_Arvind",
    "file": "Medicine_CVS_Dr_Arvind.json",
    "questions": 51,
    "path": "./MEDTRIX/DAMS_CT_FMGE.html"
  },
  {
    "title": "Medicine_EndoGastro_Dr_Rahul",
    "file": "Medicine_EndoGastro_Dr_Rahul.json",
    "questions": 50,
    "path": "./MEDTRIX/DAMS_CT_FMGE.html"
  },
  {
    "title": "Medicine_Except_CNS",
    "file": "Medicine_Except_CNS.json",
    "questions": 40,
    "path": "./MEDTRIX/DAMS_CT_FMGE.html"
  },
  {
    "title": "Medicine_GastroEndo_Dr_Rahul",
    "file": "Medicine_GastroEndo_Dr_Rahul.json",
    "questions": 55,
    "path": "./MEDTRIX/DAMS_CT_FMGE.html"
  },
  {
    "title": "Medicine_NephroRheumatRespABB_Dr_Srinath_Chandramani",
    "file": "Medicine_NephroRheumatRespABB_Dr_Srinath_Chandramani.json",
    "questions": 50,
    "path": "./MEDTRIX/DAMS_CT_FMGE.html"
  },
  {
    "title": "Medicine_NephroRhumatRespAbb_Dr_Srinath",
    "file": "Medicine_NephroRhumatRespAbb_Dr_Srinath.json",
    "questions": 40,
    "path": "./MEDTRIX/DAMS_CT_FMGE.html"
  },
  {
    "title": "Medicine_RSABBNephroRheumat_Dr_Srinath",
    "file": "Medicine_RSABBNephroRheumat_Dr_Srinath.json",
    "questions": 50,
    "path": "./MEDTRIX/DAMS_CT_FMGE.html"
  },
  {
    "title": "Micriobiology_Dr_J_suriya_FMGE_CT",
    "file": "Micriobiology_Dr_J_suriya_FMGE_CT.json",
    "questions": 40,
    "path": "./MEDTRIX/DAMS_CT_FMGE.html"
  },
  {
    "title": "Microbiology",
    "file": "Microbiology.json",
    "questions": 20,
    "path": "./MEDTRIX/DAMS_CT_FMGE.html"
  },
  {
    "title": "Microbiology_Dr_J_Suria",
    "file": "Microbiology_Dr_J_Suria.json",
    "questions": 40,
    "path": "./MEDTRIX/DAMS_CT_FMGE.html"
  },
  {
    "title": "Obstetrics_DR_Deepti_Class_Test_FMGE",
    "file": "Obstetrics_DR_Deepti_Class_Test_FMGE.json",
    "questions": 50,
    "path": "./MEDTRIX/DAMS_CT_FMGE.html"
  },
  {
    "title": "Obstetrics_Dr_Deepti",
    "file": "Obstetrics_Dr_Deepti.json",
    "questions": 40,
    "path": "./MEDTRIX/DAMS_CT_FMGE.html"
  },
  {
    "title": "Obstetrics__Gynaecology_Dr_Deepti",
    "file": "Obstetrics__Gynaecology_Dr_Deepti.json",
    "questions": 50,
    "path": "./MEDTRIX/DAMS_CT_FMGE.html"
  },
  {
    "title": "Ophthalmology_Dr_Manish",
    "file": "Ophthalmology_Dr_Manish.json",
    "questions": 40,
    "path": "./MEDTRIX/DAMS_CT_FMGE.html"
  },
  {
    "title": "Ophthalmology_FMGE",
    "file": "Ophthalmology_FMGE.json",
    "questions": 40,
    "path": "./MEDTRIX/DAMS_CT_FMGE.html"
  },
  {
    "title": "Orthopaedics_DR_Tushar_Class_Test_FMGE",
    "file": "Orthopaedics_DR_Tushar_Class_Test_FMGE.json",
    "questions": 40,
    "path": "./MEDTRIX/DAMS_CT_FMGE.html"
  },
  {
    "title": "Orthopedics_Dr_Tushar",
    "file": "Orthopedics_Dr_Tushar.json",
    "questions": 40,
    "path": "./MEDTRIX/DAMS_CT_FMGE.html"
  },
  {
    "title": "Orthopedics_Dr_Tushar_New",
    "file": "Orthopedics_Dr_Tushar_New.json",
    "questions": 40,
    "path": "./MEDTRIX/DAMS_CT_FMGE.html"
  },
  {
    "title": "PSM_Dr_Kashish",
    "file": "PSM_Dr_Kashish.json",
    "questions": 25,
    "path": "./MEDTRIX/DAMS_CT_FMGE.html"
  },
  {
    "title": "PSM_Dr_Kashish__BiostatsEpidemiologyScreening_NCDDemographyFamily_planning_MCHHealth_Progra",
    "file": "PSM_Dr_Kashish__BiostatsEpidemiologyScreening_NCDDemographyFamily_planning_MCHHealth_Progra.json",
    "questions": 20,
    "path": "./MEDTRIX/DAMS_CT_FMGE.html"
  },
  {
    "title": "PSM_FMGE",
    "file": "PSM_FMGE.json",
    "questions": 40,
    "path": "./MEDTRIX/DAMS_CT_FMGE.html"
  },
  {
    "title": "Pathology_Dr_Shagun",
    "file": "Pathology_Dr_Shagun.json",
    "questions": 40,
    "path": "./MEDTRIX/DAMS_CT_FMGE.html"
  },
  {
    "title": "Pathology_GENHemat_Dr_Shagun",
    "file": "Pathology_GENHemat_Dr_Shagun.json",
    "questions": 42,
    "path": "./MEDTRIX/DAMS_CT_FMGE.html"
  },
  {
    "title": "Pathology_GenHemat_FMGE",
    "file": "Pathology_GenHemat_FMGE.json",
    "questions": 40,
    "path": "./MEDTRIX/DAMS_CT_FMGE.html"
  },
  {
    "title": "Pathology_Systemic_Gaurav_Tehri",
    "file": "Pathology_Systemic_Gaurav_Tehri.json",
    "questions": 40,
    "path": "./MEDTRIX/DAMS_CT_FMGE.html"
  },
  {
    "title": "Pediatrics_Dr_Ashutosh",
    "file": "Pediatrics_Dr_Ashutosh.json",
    "questions": 40,
    "path": "./MEDTRIX/DAMS_CT_FMGE.html"
  },
  {
    "title": "Pediatrics_Dr_Ashutosh_Aggarwal__CT_FMGE",
    "file": "Pediatrics_Dr_Ashutosh_Aggarwal__CT_FMGE.json",
    "questions": 40,
    "path": "./MEDTRIX/DAMS_CT_FMGE.html"
  },
  {
    "title": "Pharmacology_Dr_Dinesh",
    "file": "Pharmacology_Dr_Dinesh.json",
    "questions": 40,
    "path": "./MEDTRIX/DAMS_CT_FMGE.html"
  },
  {
    "title": "Pharmacology_FMGE",
    "file": "Pharmacology_FMGE.json",
    "questions": 60,
    "path": "./MEDTRIX/DAMS_CT_FMGE.html"
  },
  {
    "title": "Physiology_Dr_Kamal",
    "file": "Physiology_Dr_Kamal.json",
    "questions": 75,
    "path": "./MEDTRIX/DAMS_CT_FMGE.html"
  },
  {
    "title": "Physiology_Dr_Kamal_FMGE_CT",
    "file": "Physiology_Dr_Kamal_FMGE_CT.json",
    "questions": 40,
    "path": "./MEDTRIX/DAMS_CT_FMGE.html"
  },
  {
    "title": "Physiology_FMGE_Dr_Prem",
    "file": "Physiology_FMGE_Dr_Prem.json",
    "questions": 40,
    "path": "./MEDTRIX/DAMS_CT_FMGE.html"
  },
  {
    "title": "Psychiatry_Dr_Sachin",
    "file": "Psychiatry_Dr_Sachin.json",
    "questions": 40,
    "path": "./MEDTRIX/DAMS_CT_FMGE.html"
  },
  {
    "title": "Psychiatry_Dr_Sachin_FMGE_CT",
    "file": "Psychiatry_Dr_Sachin_FMGE_CT.json",
    "questions": 40,
    "path": "./MEDTRIX/DAMS_CT_FMGE.html"
  },
  {
    "title": "Radiology_Dr_Sumer",
    "file": "Radiology_Dr_Sumer.json",
    "questions": 49,
    "path": "./MEDTRIX/DAMS_CT_FMGE.html"
  },
  {
    "title": "Radiology_Dr_Sumer_FMGE_CT",
    "file": "Radiology_Dr_Sumer_FMGE_CT.json",
    "questions": 60,
    "path": "./MEDTRIX/DAMS_CT_FMGE.html"
  },
  {
    "title": "Surgery_-_GIT_Dr_Rajeev",
    "file": "Surgery_-_GIT_Dr_Rajeev.json",
    "questions": 40,
    "path": "./MEDTRIX/DAMS_CT_FMGE.html"
  },
  {
    "title": "Surgery_EXCEPT_GIT_Dr_Gaurav",
    "file": "Surgery_EXCEPT_GIT_Dr_Gaurav.json",
    "questions": 40,
    "path": "./MEDTRIX/DAMS_CT_FMGE.html"
  },
  {
    "title": "Surgery_GITUrology_FMGE",
    "file": "Surgery_GITUrology_FMGE.json",
    "questions": 40,
    "path": "./MEDTRIX/DAMS_CT_FMGE.html"
  },
  {
    "title": "Surgery_GIT_HBP_Dr_RAJEEV__FMGE_CT",
    "file": "Surgery_GIT_HBP_Dr_RAJEEV__FMGE_CT.json",
    "questions": 40,
    "path": "./MEDTRIX/DAMS_CT_FMGE.html"
  },
  {
    "title": "_FMGE_CT_-_Pathology_Systemic",
    "file": "_FMGE_CT_-_Pathology_Systemic.json",
    "questions": 40,
    "path": "./MEDTRIX/DAMS_CT_FMGE.html"
  },
  {
    "title": "_Medicine_CVS__DR_Arvind_Class_Test_FMGE",
    "file": "_Medicine_CVS__DR_Arvind_Class_Test_FMGE.json",
    "questions": 40,
    "path": "./MEDTRIX/DAMS_CT_FMGE.html"
  },
  {
    "title": "Alopecia",
    "file": "Alopecia.json",
    "questions": 9,
    "path": "./MEDTRIX/derma_e_qb.html"
  },
  {
    "title": "Bacterial Infections",
    "file": "Bacterial_Infections.json",
    "questions": 13,
    "path": "./MEDTRIX/derma_e_qb.html"
  },
  {
    "title": "Blistering Disorders",
    "file": "Blistering_Disorders.json",
    "questions": 22,
    "path": "./MEDTRIX/derma_e_qb.html"
  },
  {
    "title": "Dermoepidermal Junction, DIF & Nail Diseases",
    "file": "Dermoepidermal_Junction_DIF__Nail_Diseases.json",
    "questions": 11,
    "path": "./MEDTRIX/derma_e_qb.html"
  },
  {
    "title": "Drug Reaction",
    "file": "Drug_Reaction.json",
    "questions": 8,
    "path": "./MEDTRIX/derma_e_qb.html"
  },
  {
    "title": "Eczema",
    "file": "Eczema.json",
    "questions": 20,
    "path": "./MEDTRIX/derma_e_qb.html"
  },
  {
    "title": "Fungal infection",
    "file": "Fungal_infection.json",
    "questions": 28,
    "path": "./MEDTRIX/derma_e_qb.html"
  },
  {
    "title": "General Dermatology",
    "file": "General_Dermatology.json",
    "questions": 23,
    "path": "./MEDTRIX/derma_e_qb.html"
  },
  {
    "title": "Hair Diseases -TB - Erythema Nodosum",
    "file": "Hair_Diseases_-TB_-_Erythema_Nodosum.json",
    "questions": 6,
    "path": "./MEDTRIX/derma_e_qb.html"
  },
  {
    "title": "Important Short Topics (Shapes Of Skin Lesions, Woods Lamp Disorders, Neutrophilic Dermatosis & Reactive Arthritis)",
    "file": "Important_Short_Topics_Shapes_Of_Skin_Lesions_Woods_Lamp_Disorders_Neutrophilic_Dermatosis__Reactive_Arthritis.json",
    "questions": 26,
    "path": "./MEDTRIX/derma_e_qb.html"
  },
  {
    "title": "Leprosy",
    "file": "Leprosy.json",
    "questions": 6,
    "path": "./MEDTRIX/derma_e_qb.html"
  },
  {
    "title": "Lichen Planus",
    "file": "Lichen_Planus.json",
    "questions": 11,
    "path": "./MEDTRIX/derma_e_qb.html"
  },
  {
    "title": "Mast Cell Disorders",
    "file": "Mast_Cell_Disorders.json",
    "questions": 9,
    "path": "./MEDTRIX/derma_e_qb.html"
  },
  {
    "title": "Melanin Disease",
    "file": "Melanin_Disease.json",
    "questions": 26,
    "path": "./MEDTRIX/derma_e_qb.html"
  },
  {
    "title": "Parasitic Infection",
    "file": "Parasitic_Infection.json",
    "questions": 9,
    "path": "./MEDTRIX/derma_e_qb.html"
  },
  {
    "title": "Psoriasis",
    "file": "Psoriasis.json",
    "questions": 25,
    "path": "./MEDTRIX/derma_e_qb.html"
  },
  {
    "title": "STD (Sexually Transmitted Diseases)",
    "file": "STD_Sexually_Transmitted_Diseases.json",
    "questions": 23,
    "path": "./MEDTRIX/derma_e_qb.html"
  },
  {
    "title": "Skin Cancer",
    "file": "Skin_Cancer.json",
    "questions": 19,
    "path": "./MEDTRIX/derma_e_qb.html"
  },
  {
    "title": "Viral infection",
    "file": "Viral_infection.json",
    "questions": 23,
    "path": "./MEDTRIX/derma_e_qb.html"
  },
  {
    "title": "Abdnomal Uterine Bleeding",
    "file": "Abdnomal_Uterine_Bleeding.json",
    "questions": 25,
    "path": "./MEDTRIX/gyne__e_qb.html"
  },
  {
    "title": "Adnexal Management",
    "file": "Adnexal_Management.json",
    "questions": 15,
    "path": "./MEDTRIX/gyne__e_qb.html"
  },
  {
    "title": "Anatomy Of External Genitalia",
    "file": "Anatomy_Of_External_Genitalia.json",
    "questions": 9,
    "path": "./MEDTRIX/gyne__e_qb.html"
  },
  {
    "title": "Artificial Reproductive Technology",
    "file": "Artificial_Reproductive_Technology.json",
    "questions": 8,
    "path": "./MEDTRIX/gyne__e_qb.html"
  },
  {
    "title": "Cervical Cancer",
    "file": "Cervical_Cancer_1.json",
    "questions": 29,
    "path": "./MEDTRIX/gyne__e_qb.html"
  },
  {
    "title": "Congenital Mullerian Malformations",
    "file": "Congenital_Mullerian_Malformations.json",
    "questions": 16,
    "path": "./MEDTRIX/gyne__e_qb.html"
  },
  {
    "title": "Embryology",
    "file": "Embryology_1.json",
    "questions": 6,
    "path": "./MEDTRIX/gyne__e_qb.html"
  },
  {
    "title": "Emergency Contraception",
    "file": "Emergency_Contraception.json",
    "questions": 2,
    "path": "./MEDTRIX/gyne__e_qb.html"
  },
  {
    "title": "Endometrial Carcinoma",
    "file": "Endometrial_Carcinoma.json",
    "questions": 11,
    "path": "./MEDTRIX/gyne__e_qb.html"
  },
  {
    "title": "Endometriosis",
    "file": "Endometriosis_1.json",
    "questions": 23,
    "path": "./MEDTRIX/gyne__e_qb.html"
  },
  {
    "title": "Epithelial Ovarian Cancer",
    "file": "Epithelial_Ovarian_Cancer.json",
    "questions": 22,
    "path": "./MEDTRIX/gyne__e_qb.html"
  },
  {
    "title": "Female Infertility",
    "file": "Female_Infertility_1.json",
    "questions": 22,
    "path": "./MEDTRIX/gyne__e_qb.html"
  },
  {
    "title": "Genital Fistula",
    "file": "Genital_Fistula.json",
    "questions": 8,
    "path": "./MEDTRIX/gyne__e_qb.html"
  },
  {
    "title": "Genital Prolapse",
    "file": "Genital_Prolapse.json",
    "questions": 23,
    "path": "./MEDTRIX/gyne__e_qb.html"
  },
  {
    "title": "Germ Cell And Sex Cord Storms Cancer",
    "file": "Germ_Cell_And_Sex_Cord_Storms_Cancer.json",
    "questions": 23,
    "path": "./MEDTRIX/gyne__e_qb.html"
  },
  {
    "title": "Gestational Trophoblastic Neoplasia",
    "file": "Gestational_Trophoblastic_Neoplasia.json",
    "questions": 6,
    "path": "./MEDTRIX/gyne__e_qb.html"
  },
  {
    "title": "Hirusitsm",
    "file": "Hirusitsm.json",
    "questions": 9,
    "path": "./MEDTRIX/gyne__e_qb.html"
  },
  {
    "title": "Hormonal Contraception",
    "file": "Hormonal_Contraception.json",
    "questions": 14,
    "path": "./MEDTRIX/gyne__e_qb.html"
  },
  {
    "title": "Internal Genitalia (Vagina And Ovary)",
    "file": "Internal_Genitalia_Vagina_And_Ovary.json",
    "questions": 21,
    "path": "./MEDTRIX/gyne__e_qb.html"
  },
  {
    "title": "Internal Genitalia - (Uterus And Fallopian Tube)",
    "file": "Internal_Genitalia_-_Uterus_And_Fallopian_Tube.json",
    "questions": 18,
    "path": "./MEDTRIX/gyne__e_qb.html"
  },
  {
    "title": "Male Infertility",
    "file": "Male_Infertility.json",
    "questions": 17,
    "path": "./MEDTRIX/gyne__e_qb.html"
  },
  {
    "title": "Menopause And HRT",
    "file": "Menopause_And_HRT.json",
    "questions": 17,
    "path": "./MEDTRIX/gyne__e_qb.html"
  },
  {
    "title": "Missed pill management",
    "file": "Missed_pill_management.json",
    "questions": 9,
    "path": "./MEDTRIX/gyne__e_qb.html"
  },
  {
    "title": "Mnemonics to Remember Cancer Staging",
    "file": "Mnemonics_to_Remember_Cancer_Staging.json",
    "questions": 7,
    "path": "./MEDTRIX/gyne__e_qb.html"
  },
  {
    "title": "Natural Family Planning Method And Barrier Method",
    "file": "Natural_Family_Planning_Method_And_Barrier_Method.json",
    "questions": 14,
    "path": "./MEDTRIX/gyne__e_qb.html"
  },
  {
    "title": "Normal & Abnormal Puberty",
    "file": "Normal__Abnormal_Puberty.json",
    "questions": 22,
    "path": "./MEDTRIX/gyne__e_qb.html"
  },
  {
    "title": "PCOS",
    "file": "PCOS.json",
    "questions": 24,
    "path": "./MEDTRIX/gyne__e_qb.html"
  },
  {
    "title": "Pelvic Inflammatory Disease",
    "file": "Pelvic_Inflammatory_Disease.json",
    "questions": 27,
    "path": "./MEDTRIX/gyne__e_qb.html"
  },
  {
    "title": "Permanent Sterilisation",
    "file": "Permanent_Sterilisation.json",
    "questions": 7,
    "path": "./MEDTRIX/gyne__e_qb.html"
  },
  {
    "title": "Premalignant Lesion Of Endometrium",
    "file": "Premalignant_Lesion_Of_Endometrium.json",
    "questions": 10,
    "path": "./MEDTRIX/gyne__e_qb.html"
  },
  {
    "title": "Premalignant Lesions Of Cervix",
    "file": "Premalignant_Lesions_Of_Cervix.json",
    "questions": 15,
    "path": "./MEDTRIX/gyne__e_qb.html"
  },
  {
    "title": "Primary Amenorrhea",
    "file": "Primary_Amenorrhea.json",
    "questions": 27,
    "path": "./MEDTRIX/gyne__e_qb.html"
  },
  {
    "title": "Reproductive Physiology",
    "file": "Reproductive_Physiology.json",
    "questions": 9,
    "path": "./MEDTRIX/gyne__e_qb.html"
  },
  {
    "title": "Urinary Incontinence",
    "file": "Urinary_Incontinence.json",
    "questions": 11,
    "path": "./MEDTRIX/gyne__e_qb.html"
  },
  {
    "title": "Uterine Fibroids",
    "file": "Uterine_Fibroids.json",
    "questions": 32,
    "path": "./MEDTRIX/gyne__e_qb.html"
  },
  {
    "title": "Vaginitis",
    "file": "Vaginitis.json",
    "questions": 7,
    "path": "./MEDTRIX/gyne__e_qb.html"
  },
  {
    "title": "Vulval Cancer",
    "file": "Vulval_Cancer.json",
    "questions": 6,
    "path": "./MEDTRIX/gyne__e_qb.html"
  },
  {
    "title": "All_Recent_Updates_2021-Previous_Year_Questions",
    "file": "All_Recent_Updates_2021-Previous_Year_Questions.json",
    "questions": 1,
    "path": "./MEDTRIX/prepx_PSM.html"
  },
  {
    "title": "Allied_Health_Disciplines-ESI_Act__Factory_Act__NREGA_Act_and_Disaster_Management",
    "file": "Allied_Health_Disciplines-ESI_Act__Factory_Act__NREGA_Act_and_Disaster_Management.json",
    "questions": 13,
    "path": "./MEDTRIX/prepx_PSM.html"
  },
  {
    "title": "Allied_Health_Disciplines-Occupational_health",
    "file": "Allied_Health_Disciplines-Occupational_health.json",
    "questions": 20,
    "path": "./MEDTRIX/prepx_PSM.html"
  },
  {
    "title": "Allied_Health_Disciplines-Previous_Year_Questions",
    "file": "Allied_Health_Disciplines-Previous_Year_Questions.json",
    "questions": 49,
    "path": "./MEDTRIX/prepx_PSM.html"
  },
  {
    "title": "Biomedical_Waste_Management-Biomedical_waste_management_and_Genetics_and_Health",
    "file": "Biomedical_Waste_Management-Biomedical_waste_management_and_Genetics_and_Health.json",
    "questions": 15,
    "path": "./MEDTRIX/prepx_PSM.html"
  },
  {
    "title": "Biomedical_Waste_Management-Previous_Year_Questions",
    "file": "Biomedical_Waste_Management-Previous_Year_Questions.json",
    "questions": 4,
    "path": "./MEDTRIX/prepx_PSM.html"
  },
  {
    "title": "Biostatistics-Biostatistics_and_Measures_of_Central_Tendency",
    "file": "Biostatistics-Biostatistics_and_Measures_of_Central_Tendency.json",
    "questions": 10,
    "path": "./MEDTRIX/prepx_PSM.html"
  },
  {
    "title": "Biostatistics-Previous_Year_Questions",
    "file": "Biostatistics-Previous_Year_Questions.json",
    "questions": 61,
    "path": "./MEDTRIX/prepx_PSM.html"
  },
  {
    "title": "Biostatistics-Types_of_Dispersion__Distribution__and_Errors",
    "file": "Biostatistics-Types_of_Dispersion__Distribution__and_Errors.json",
    "questions": 20,
    "path": "./MEDTRIX/prepx_PSM.html"
  },
  {
    "title": "Communicable_and_Non-communicable_Diseases-Acute_Respiratory_Infection_and_Tuberculosis",
    "file": "Communicable_and_Non-communicable_Diseases-Acute_Respiratory_Infection_and_Tuberculosis.json",
    "questions": 10,
    "path": "./MEDTRIX/prepx_PSM.html"
  },
  {
    "title": "Communicable_and_Non-communicable_Diseases-Chicken_Pox__Small_Pox_and_Diphtheria",
    "file": "Communicable_and_Non-communicable_Diseases-Chicken_Pox__Small_Pox_and_Diphtheria.json",
    "questions": 10,
    "path": "./MEDTRIX/prepx_PSM.html"
  },
  {
    "title": "Communicable_and_Non-communicable_Diseases-Dengue__Malaria__and_Rabies",
    "file": "Communicable_and_Non-communicable_Diseases-Dengue__Malaria__and_Rabies.json",
    "questions": 16,
    "path": "./MEDTRIX/prepx_PSM.html"
  },
  {
    "title": "Communicable_and_Non-communicable_Diseases-Filariasis__Leptospirosis__Japanese_Encephalitis__and_Helminthic_Infections",
    "file": "Communicable_and_Non-communicable_Diseases-Filariasis__Leptospirosis__Japanese_Encephalitis__and_Helminthic_Infections.json",
    "questions": 13,
    "path": "./MEDTRIX/prepx_PSM.html"
  },
  {
    "title": "Communicable_and_Non-communicable_Diseases-Infectious_Epidemiology",
    "file": "Communicable_and_Non-communicable_Diseases-Infectious_Epidemiology.json",
    "questions": 20,
    "path": "./MEDTRIX/prepx_PSM.html"
  },
  {
    "title": "Communicable_and_Non-communicable_Diseases-Mumps__Measles__Rubella__Pertussis",
    "file": "Communicable_and_Non-communicable_Diseases-Mumps__Measles__Rubella__Pertussis.json",
    "questions": 10,
    "path": "./MEDTRIX/prepx_PSM.html"
  },
  {
    "title": "Communicable_and_Non-communicable_Diseases-Plague__Tetanus__HIV_AIDS__Rickettsial_Disease__Ebola__Nipah_and_Zika_Virus",
    "file": "Communicable_and_Non-communicable_Diseases-Plague__Tetanus__HIV_AIDS__Rickettsial_Disease__Ebola__Nipah_and_Zika_Virus.json",
    "questions": 15,
    "path": "./MEDTRIX/prepx_PSM.html"
  },
  {
    "title": "Communicable_and_Non-communicable_Diseases-Polio__Hepatitis__Diarrhoea__Cholera___Typhoid",
    "file": "Communicable_and_Non-communicable_Diseases-Polio__Hepatitis__Diarrhoea__Cholera___Typhoid.json",
    "questions": 12,
    "path": "./MEDTRIX/prepx_PSM.html"
  },
  {
    "title": "Communicable_and_Non-communicable_Diseases-Previous_Year_Questions",
    "file": "Communicable_and_Non-communicable_Diseases-Previous_Year_Questions.json",
    "questions": 105,
    "path": "./MEDTRIX/prepx_PSM.html"
  },
  {
    "title": "Concept_of_Health_and_Disease-Concept_of_Disease___Well-Being",
    "file": "Concept_of_Health_and_Disease-Concept_of_Disease___Well-Being.json",
    "questions": 10,
    "path": "./MEDTRIX/prepx_PSM.html"
  },
  {
    "title": "Concept_of_Health_and_Disease-Disease_Control__Monitoring_and_Surveillance",
    "file": "Concept_of_Health_and_Disease-Disease_Control__Monitoring_and_Surveillance.json",
    "questions": 15,
    "path": "./MEDTRIX/prepx_PSM.html"
  },
  {
    "title": "Concept_of_Health_and_Disease-Health_Indicators",
    "file": "Concept_of_Health_and_Disease-Health_Indicators.json",
    "questions": 5,
    "path": "./MEDTRIX/prepx_PSM.html"
  },
  {
    "title": "Concept_of_Health_and_Disease-Previous_Year_Questions",
    "file": "Concept_of_Health_and_Disease-Previous_Year_Questions.json",
    "questions": 21,
    "path": "./MEDTRIX/prepx_PSM.html"
  },
  {
    "title": "Demography_and_Health-Demography_and_Health",
    "file": "Demography_and_Health-Demography_and_Health.json",
    "questions": 25,
    "path": "./MEDTRIX/prepx_PSM.html"
  },
  {
    "title": "Demography_and_Health-Previous_Year_Questions",
    "file": "Demography_and_Health-Previous_Year_Questions.json",
    "questions": 24,
    "path": "./MEDTRIX/prepx_PSM.html"
  },
  {
    "title": "Environment_and_Health-Air__Light__Sound__and_Radiation",
    "file": "Environment_and_Health-Air__Light__Sound__and_Radiation.json",
    "questions": 16,
    "path": "./MEDTRIX/prepx_PSM.html"
  },
  {
    "title": "Environment_and_Health-Entomology",
    "file": "Environment_and_Health-Entomology.json",
    "questions": 12,
    "path": "./MEDTRIX/prepx_PSM.html"
  },
  {
    "title": "Environment_and_Health-Previous_Year_Questions",
    "file": "Environment_and_Health-Previous_Year_Questions.json",
    "questions": 34,
    "path": "./MEDTRIX/prepx_PSM.html"
  },
  {
    "title": "Environment_and_Health-Water-_Introduction_and_Purification",
    "file": "Environment_and_Health-Water-_Introduction_and_Purification.json",
    "questions": 15,
    "path": "./MEDTRIX/prepx_PSM.html"
  },
  {
    "title": "Epidemiology-Basics_of_Epidemiology",
    "file": "Epidemiology-Basics_of_Epidemiology.json",
    "questions": 11,
    "path": "./MEDTRIX/prepx_PSM.html"
  },
  {
    "title": "Epidemiology-Bias_and_confounders",
    "file": "Epidemiology-Bias_and_confounders.json",
    "questions": 9,
    "path": "./MEDTRIX/prepx_PSM.html"
  },
  {
    "title": "Epidemiology-Previous_Year_Questions",
    "file": "Epidemiology-Previous_Year_Questions.json",
    "questions": 69,
    "path": "./MEDTRIX/prepx_PSM.html"
  },
  {
    "title": "Epidemiology-Study_Designs_in_Epidemology",
    "file": "Epidemiology-Study_Designs_in_Epidemology.json",
    "questions": 31,
    "path": "./MEDTRIX/prepx_PSM.html"
  },
  {
    "title": "Epidemiology-Systematic_Review__Meta-Analysis__and_Evidence-Based_Studies",
    "file": "Epidemiology-Systematic_Review__Meta-Analysis__and_Evidence-Based_Studies.json",
    "questions": 6,
    "path": "./MEDTRIX/prepx_PSM.html"
  },
  {
    "title": "Family_Planning_and_Contraceptives-Family_Planning_and_Contraceptives",
    "file": "Family_Planning_and_Contraceptives-Family_Planning_and_Contraceptives.json",
    "questions": 27,
    "path": "./MEDTRIX/prepx_PSM.html"
  },
  {
    "title": "Family_Planning_and_Contraceptives-Previous_Year_Questions",
    "file": "Family_Planning_and_Contraceptives-Previous_Year_Questions.json",
    "questions": 17,
    "path": "./MEDTRIX/prepx_PSM.html"
  },
  {
    "title": "Health_Care_of_The_Community_in_India-Healthcare_of_Community_and_Health_Delivery_Systems",
    "file": "Health_Care_of_The_Community_in_India-Healthcare_of_Community_and_Health_Delivery_Systems.json",
    "questions": 18,
    "path": "./MEDTRIX/prepx_PSM.html"
  },
  {
    "title": "Health_Care_of_The_Community_in_India-Previous_Year_Questions",
    "file": "Health_Care_of_The_Community_in_India-Previous_Year_Questions.json",
    "questions": 25,
    "path": "./MEDTRIX/prepx_PSM.html"
  },
  {
    "title": "Health_Education_and_Communication-Health_Education_and_Communication",
    "file": "Health_Education_and_Communication-Health_Education_and_Communication.json",
    "questions": 8,
    "path": "./MEDTRIX/prepx_PSM.html"
  },
  {
    "title": "Health_Education_and_Communication-Previous_Year_Questions",
    "file": "Health_Education_and_Communication-Previous_Year_Questions.json",
    "questions": 20,
    "path": "./MEDTRIX/prepx_PSM.html"
  },
  {
    "title": "Health_Planning_and_Management-Health_Planning_and_Management",
    "file": "Health_Planning_and_Management-Health_Planning_and_Management.json",
    "questions": 8,
    "path": "./MEDTRIX/prepx_PSM.html"
  },
  {
    "title": "Health_Planning_and_Management-Previous_Year_Questions",
    "file": "Health_Planning_and_Management-Previous_Year_Questions.json",
    "questions": 15,
    "path": "./MEDTRIX/prepx_PSM.html"
  },
  {
    "title": "International_Health-International_health",
    "file": "International_Health-International_health.json",
    "questions": 6,
    "path": "./MEDTRIX/prepx_PSM.html"
  },
  {
    "title": "International_Health-Previous_Year_Questions",
    "file": "International_Health-Previous_Year_Questions.json",
    "questions": 7,
    "path": "./MEDTRIX/prepx_PSM.html"
  },
  {
    "title": "Miscellaneous-Previous_Year_Questions",
    "file": "Miscellaneous-Previous_Year_Questions_1.json",
    "questions": 8,
    "path": "./MEDTRIX/prepx_PSM.html"
  },
  {
    "title": "National_Health_Programs-Blindness_control_program__NLEP__Health_programs_misc_",
    "file": "National_Health_Programs-Blindness_control_program__NLEP__Health_programs_misc_.json",
    "questions": 11,
    "path": "./MEDTRIX/prepx_PSM.html"
  },
  {
    "title": "National_Health_Programs-Endgame_strategy_and_national_polio_surveillance_program",
    "file": "National_Health_Programs-Endgame_strategy_and_national_polio_surveillance_program.json",
    "questions": 6,
    "path": "./MEDTRIX/prepx_PSM.html"
  },
  {
    "title": "National_Health_Programs-NACP_global_initiatives",
    "file": "National_Health_Programs-NACP_global_initiatives.json",
    "questions": 12,
    "path": "./MEDTRIX/prepx_PSM.html"
  },
  {
    "title": "National_Health_Programs-NCDS___NPCDS",
    "file": "National_Health_Programs-NCDS___NPCDS.json",
    "questions": 11,
    "path": "./MEDTRIX/prepx_PSM.html"
  },
  {
    "title": "National_Health_Programs-NVBDCP",
    "file": "National_Health_Programs-NVBDCP.json",
    "questions": 15,
    "path": "./MEDTRIX/prepx_PSM.html"
  },
  {
    "title": "National_Health_Programs-National_TB_Elimination_Program__NTEP_",
    "file": "National_Health_Programs-National_TB_Elimination_Program__NTEP_.json",
    "questions": 20,
    "path": "./MEDTRIX/prepx_PSM.html"
  },
  {
    "title": "National_Health_Programs-National_health_mission_RMNCH_-_A___maternal_initiatives__Child_and_adolescents_health_initiatives",
    "file": "National_Health_Programs-National_health_mission_RMNCH_-_A___maternal_initiatives__Child_and_adolescents_health_initiatives.json",
    "questions": 14,
    "path": "./MEDTRIX/prepx_PSM.html"
  },
  {
    "title": "National_Health_Programs-Previous_Year_Questions",
